department,program,lib_link,year,thesis_in_that_year,thesis_link,pdf_link,author,title,published,description,series,language,summary,note,filetype,localnote,access,systemdet,subject,alttitle,program_sampling
IR,MA,https://tinyurl.com/iresma2018,2018,45,https://sierra.ceu.edu/record=b1399014,http://www.etd.ceu.edu/2018/aslantepe_goknur.pdf ,"Aslantepe, Göknur",Women politicians of a masculine state : gendered politics in Turkey / Göknur Aslantepe,"Budapest : Central European University, 2018",53 p. ; 30 cm.,CEU International Relations Department master theses ; 2018/3,Women -- Turkey -- Political activity,English,The thesis examines the masculine character of the branches of government of Turkey. Theoretical framework of the thesis is based on feminist international relation theory. Thesis demonstrate the futures of male-dominated politics by investigations historical process of women and current conditions of women politicians in political institutions of Turkey.,Degree: MA,PDF file (835k),ETD,Unrestricted,Women in politics -- Turkey,,MA
Gender studies,MA,https://tinyurl.com/genderma2020,2020,26,https://sierra.ceu.edu/record=b1428475,http://www.etd.ceu.edu/2020/edwards_jennifer.pdf ,"Edwards, Jennifer Catherine","Queer(ing) community : queer community, spatiality, and temporality in Madison, WI / Jennifer Edwards","Budapest : Central European University, 2020",98 p. ; 30 cm.,CEU Gender Studies Department master theses ; 2020/10,English,"This thesis is a blended ethnographic analysis of the queer nightlife scene in Madison, Wisconsin USA, focused specifically on queer pop-up events. These events began in reaction to a homonormative and exclusionary permanent gay nightlife scene. I begin by providing background about Madison, its queer subculture, and the racial and class dynamics within the city. In the first chapter, I address the complications of defining queerness and community in both academic and organizing work, engaging in theoretical understandings of both terms, as well as incorporating the definitions and understandings of research participants. I use discourse analysis to parse the descriptions of several queer pop-up events in Madison and the political engagements of both permanent gay bars and Queer Pressure, a significant queer pop-up event series. In the second chapter, I begin with an analysis of the notion of the sacred within th scene, then move to engage with Jack Halberstam’s concepts of queer temporality and spatiality to consider the implications and possibilites of pop-up and queer takeover style events, in part by reflecting on sets, the spaces the parties take place in, and the transient nature of event series and Madison queers. In the third chapter, I take up the question of queer politics and intersectionality by reading Micheal Warner’s definition of queer politics alongside Lisa Duggan’s conception of the homonormative, and reflect on the resonances of intersectionality and crip theory within these frameworks. I then discuss the homonormative politics of the Madison LGBTQ+ community, and contrast them with an analysis of Queer Pressure’s political commitments. The final section of this chapter is a case study of the No Cops at Pride movement, reactions to and consequences of its engagement with radical queer politics, and a brief analysis of the resonance of this movement in 2018 with the racial justice mass movement of 2020. Ultimately, I do not strive to make any overarching conclusions with this thesis, but rather to take seriously and consider deeply a particular moment in time in the place that I consider home, and to gesture towards a more complex engagement with the queer spaces that exists in between the rural and the urban in the United States.",Degree: MA,PDF,ETD,Unrestricted,System requirements: Adobe Acrobat Reader; PostScript compatible printer,,,MA
Mathematics,MA,https://tinyurl.com/mathma2019,2019,3,https://sierra.ceu.edu/record=b1421494,http://www.etd.ceu.edu/2019/ramanantoanina_andri.pdf ,"Ramanantoanina, Andriamahenina",Topological classification of links associated with plane curve singularities / Andriamahenina Ramanantoanina,"Budapest : Central European University, 2019",36 p. ; 30 cm.,CEU Department of Mathematics master theses ; 2019/3,English,"In order to protect users from spam, financial scams or malware, security com- panies, such as ESET,1 tend to block dangerous domains and Internet Protocol (IP) addresses. Many of them are chronically known for spreading malware and thus blacklisted, while others are known as clean and whitelisted sources. However, most dangerous domains/IPs are unknown. The aim of this project is to assign a malware probability to domains/IPs using a large scale data on a temporal bipartite network. We model the associated reputation problem as a network interference and graph mining problem, where we construct layers of domains and IP addresses, and seed tthe network with empirical ground truth on malware sources. Then we run the voter model of information spreading to estimate marginal probabilities of domains/IPs being blacklisted. Our analysis provides an intuitive, scalable way of identifying previously unknown, dangerous sources online.",Degree: MSc,PDF file (987k),ETD,Unrestricted,System requirements: Adobe Acrobat Reader; PostScript compatible printer,,,MA
Environmental sciences,MESPOM,https://tinyurl.com/envmespom2020,2020,12,https://sierra.ceu.edu/record=b1428076,http://www.etd.ceu.edu/2020/black_benjamin.pdf ,"Black, Benjamin Samuel",Assessing the ecological effectiveness of protected areas in Cambodia : a quasi-experimental counterfactual estimation of avoided deforestation / Benjamin Black,"Budapest : Central European University, 2020",209 p. ; 30 cm.,CEU Department of ES MESPOM Programme master theses ; 2020/2,English,"In the face of global environmental change, protected areas (PAs) have become an increasingly important tool in modern conservation, and as such there is a clear imperative to maximise the benefits they provide. In this regard a growing field of interest is the quantification of PA ecological effectiveness, often expressed in terms of avoided deforestation achieved relative to unprotected areas. However, such assessments are confounded by biases in both the non-random siting of PAs within landscapes as well as differential pressure upon their resources. These biases can be overcome by the use of quasi-experimental counterfactual study designs, that evaluate the impact of PAs against control areas of ‘similar’ biophysical and socio-economic characteristics. To contribute towards this knowledge domain this study presents an assessment of PA effectiveness for the Southeast Asian nation Cambodia, which, in light of its history of natural resource management, represents a pertinent case study. PA effectiveness was analysed using propensity score matching for three different outcome periods between 2010-2018 with the results finding significant positive treatment effects in each, with forested land in PAs being as much as 8% less likely to be deforested than similar unprotected forest. In addition to this a significant positive spillover effect of PAs was observed in 5km buffers zones adjacent to their boundaries, resulting in a maximum of 4% reduction in probability of deforestation. Furthermore, the effectiveness of PAs in Cambodia was found to vary under differential deforestation pressure as well as with regards to the duration of time since PA establishment.",Degree: MSc,PDF file (6599k),ETD,Unrestricted,System requirements: Adobe Acrobat Reader; PostScript compatible printer,,,MA
Economics,MA,https://tinyurl.com/ecoma2019,2019,72,https://sierra.ceu.edu/record=b1421213,http://www.etd.ceu.edu/2019/tspnetsyan_arpine.pdf ,"Tspnetsyan, Arpine",The impact of financial regulation on bank risk-taking : capital adequacy regulation vs deposit insurance / Arpine Tspnetsyan,"Budapest : Central European University, 2019",20 p. ; 30 cm.,CEU Economics Department master theses ; 2019/35,English,"This paper, based on the reviewed literature, conducts a secondary analysis to understand what are the incentives which increase the level of risk-taking in the banking sector, whether there is intense competition giving significant grounds to the banks for excessive risk-taking. Additionally, it discusses how financial regulation impacts the risk-taking in the banking sector and the possible flaws of the regulation. A comparison is conducted between two preventive governmental interventions: Capital adequacy requirement and Deposit Insurance. Further policy recommendations have been made to improve financial regulation in the banking sector.",Degree: MA,PDF file (398k),ETD,Unrestricted,System requirements: Adobe Acrobat Reader; PostScript compatible printer,,,MA
Political science,MA,https://tinyurl.com/polma2020,2020,42,https://sierra.ceu.edu/record=b1427942,http://www.etd.ceu.edu/2020/lazarescu_paul.pdf ,"Lazarescu, Paul Manuel",Understanding the implications of the Hart-Celler Act / Paul Manuel Lazarescu,"Budapest : Central European University, 2020",54 p. ; 30 cm.,CEU Political Science Department master theses ; 2020/9,English,"The Hart-Celler Act, formally known as the Immigration and Nationality Act of 1965, has had a thought-provokingly stellar impact on U.S. immigration. This act eliminated discrimination against certain ethnic groups that had persisted since the Immigration Act of 1924 which established the National Origins Formula. Under the National Origins Formula, immigration quotas were put into place in order to limit the number of immigrants from regions of the world that would negatively alter the ethnic distribution of the United States. The era within which the Hart-Celler Act was passed was one of a great change in the psyche of the U.S. demos towards a more liberal, global way of thinking by removing these quotas and creating a better system through which residency could be acquired. The changing of times and inability to address it since, however, has led to immigration becoming a forefront of political debate in the United States today. This has culminated in the presidential campaign and subsequent election of Donald J. Trump, whose primary campaign issue revolved around racially charged sentiments and the problems of immigration. My aim here is to assess, from relevant data and evidence, the impact of the Hart-Celler Act by examining a) how it improved or faulted as legislation upon its predecessor – via reallocation of immigration slots from Northern Europe to 3rd world inhabitants or the creation of chain migration – and b) the economic and social consequences that have occurred in the fifty years following. I shall follow this up by developing a normative scale upon which to judge the competing immigration theories, which is succeeded by taking a look at philosophical literature in search of providing a clearer picture regarding the moral debate surrounding immigration today. I conclude a) that Congress passed a law improving on many of the shortcomings of its predecessor, though it has not been spared criticism on pragmatic grounds; and b) that the legislative changes cultivated fairly positive economic consequences. Additionally, I assert that sole adherence to either theory of immigration is too narrow in approaching the problem of reform and that collaborative measures that are understanding of both sides’ interpretations of justice is the most suitable path forward.",,PDF file (924k),ETD,Unrestricted,System requirements: Adobe Acrobat Reader; PostScript compatible printer,,,MA
Legal studies,MA,https://tinyurl.com/legalma2020,2020,78,https://sierra.ceu.edu/record=b1428993,http://www.etd.ceu.edu/2020/borodenchyk_tereza.pdf ,"Borodenchyk, Tereza",Violent attacks against Roma by right-wing radical groups in Hungary and Ukraine / Tereza Borodenchyk,"Budapest : Central European University, 2020",39 p. ; 30 cm.,CEU Legal Studies Department master theses ; 2020/13,English,"Right-wing ideology is a movement based on the belief in the superiority of some individuals and groups as well as the inferiority of others. This ideology caused a number of violent attacks against Roma in Hungary in 2008-2009 and in Ukraine in 2018. Members of right-wing movements attacked Roma settlements, destroying houses, injuring and killing people. The two main focuses of the paper are: to discuss the social and political pre-conditions and the general societal environments in which the attacks were committed, and to outline the main human rights violations committed by the states while responding (or not responding) to the attacks.",Degree: MA,PDF file (490k),ETD,Unrestricted,System requirements: Adobe Acrobat Reader; PostScript compatible printer,,,MA
IR,MA,https://tinyurl.com/iresma2020,2020,39,https://sierra.ceu.edu/record=b1429245,http://www.etd.ceu.edu/2020/bihan-poudec_emma.pdf ,"Bihan-Poudec, Emma Isma","An analysis of the demobilisation, disarmament and reintegration process of former FARC fighters in Colombia / Emma Isma Bihan-Poudec","Budapest : Central European University, 2020",57 p. ; 30 cm.,CEU International Relations Department master theses ; 2020/11,English,"The implementation of Disarmament, Demobilisation and Reintegration (DDR) processes represent an important part of post-conflict transition. By enforcing the stateâ€™s monopoly on armed forces and integrating political opponents, these mechanisms hold a promising potential towards the reconstruct war-torn nations. In 2016, the government of Colombia reached an historic peace deal with the FARC (Fuerzas Armadas Revolucionarias de Colombia) guerrilla, thus ending the longest lasting civil war in the Americas. After more than 50 years of civil war, in which hundreds of thousands were killed and millions displaced, the implementation of DDR started. Now in its third year, the implementation is slow, uneven and is encountering several difficulties. In August 2019, some ex-FARC leaders called for the return of an armed insurgency, citing the failures of the Colombian government in implementing the Peace Agreement. As mitigated results of the DDR in Colombia emerge, an overall assessment is valuable. This paper aims to provide insights in the implementation of the DDR process of former FARC fighters in Colombia. The research is based on process-tracing and semi-structured interviews conducted with organisations which designed, implemented and monitored of the peace process. By combining these insights and methods, this research permits to highlights the successes and challenges of this DDR process. This research identifies key obstacles and opportunities for DDR in Colombia, highlighting the programmatic successes for the demobilisation and disarmament phases and identifying institutional weakness, programmatic flaws and the role of spoilers as key explanatory factors for the shortcomings of the reintegration in Colombia.",Degree: MA,PDF file (454k),ETD,Unrestricted,System requirements: Adobe Acrobat Reader; PostScript compatible printer,,,MA
Political science,MA,https://tinyurl.com/polma2018,2018,43,https://sierra.ceu.edu/record=b1399921,http://www.etd.ceu.edu/2018/shishov_aleksandr.pdf ,"Shishov, Aleksandr",Identifying the Heideggerian footprint in post-communist Russia's radical political thought / Aleksandr Shishov,"Budapest : Central European University, 2018",61 p. ; 30 cm.,CEU Political Science Department master theses ; 2018/33,English,"At present, despite significant interest in Russian politics and its benchmark status for claims regarding the rise of illiberal tendencies, very little is done to investigate the developments within Russia’s eclectic philosophical landscape. This paper examines the political theory of one the most controversial and curious Russian intellectuals - Aleksandr Dugin. In his key work “The Fourth Political Theory” Dugin dismisses liberalism, communism and fascism and proposes an approach to political philosophy that, according to his argumentation, fosters an authentic relationship with Being by conceptualising Heidegger’s category of Dasein as the subject of politics. This paper suggests that Dugin’s theory constitutes a genuine and unique example of Right-Heideggerianism and expands on the ideas of conservative revolutionaries through incorporating the major theoretical developments of the 20th century. It is demonstrated that identifying the key premise of Dugin’s approach to political philosophy as the insistence on the ontological primacy of community in relation to the construction of the human self, envisioned in Heideggerian terms, allows for Dugin’s political application of Heidegger’s fundamental ontology to be both sufficiently distinct from present currents in political thought, and flexible to be appropriated as a new conceptual foundation by a wide array of radical conservative and right-wing movements.",,PDF file (884k),ETD,Unrestricted,System requirements: Adobe Acrobat Reader; PostScript compatible printer,,,MA
Legal studies,MA,https://tinyurl.com/legalma2019,2019,50,https://sierra.ceu.edu/record=b1424434,http://www.etd.ceu.edu/2020/leshkovych_taras.pdf ,"Leshkovych, Taras","Evolution of the educational rights of minorities in the League of Nations, United Nations and Council of Europe systems / Taras Leshkovych","Budapest : Central European University, 2019",73 p. ; 30 cm.,CEU Legal Studies Department master theses ; 2019/39,English,"The present thesis is devoted to the comprehensive analysis of the historic development of the educational rights of persons belonging to national or ethnic, religious or linguistic minorities. The study focuses on the transformation of the minorities’ protection regimes established within the League of Nations after World War I into more individualistic system of the protection of the rights of persons belonging to minorities that emerged after World War II within the United Nations and Council of Europe. From the wide array of the rights of persons belonging to minorities, education plays a crucial role and is paramount to the survival and further development of minority communities. While the rights of persons belonging to minorities are perceived as individual rights – such approach is practical and important for jurisdictional reasons, the collective aspect of minority rights is undisputed. This is particularly relevant for the educational rights of persons belonging to minorities, as educational process mostly has collective character. The research focuses on the evolution of minority education rights within three legal systems: minority protection regimes under the League of Nations, educational rights of persons belonging to minority groups under the United Nations, and the regional Council of Europe system. The study also provides an overview of modern understanding of the educational rights of persons belonging to minority groups. In this aspect, thesis analyzes the minority rights as human rights – focusing on the subjective element of the minority education rights, and examines the content or material elements of the educational rights of minorities.",Degree: MA,PDF file (904k),ETD,Unrestricted,System requirements: Adobe Acrobat Reader; PostScript compatible printer,,,MA
Environmental sciences,MSc,https://tinyurl.com/envma2020,2020,15,https://sierra.ceu.edu/record=b1429397,http://www.etd.ceu.edu/2020/thomas_geoffrey.pdf ,"Thomas, Geoffrey","Valuing and relating to the more-than-human world : Latour, Haraway and the life frame of values / Geoffrey Thomas","Budapest : Central European University, 2020",100 p. ; 30 cm.,CEU Department of Environmental Sciences & Policy master theses ; 2020/13,English,"This thesis examines making intrinsic values work; integrating intrinsic values of the more‐than‐human world through the Life Framework of Values using the perspectives of Haraway and Latour. O’Connor and Kenter’s Life Framework of Values (LFV) is an innovative and comprehensible means to communicate intrinsic and relational values, which are conceived of as related to living with, from, in and as the more-than-human world. The LFV seeks to operationalize intrinsic values in the context of conservation and sustainability. This thesis brings perspectives from Latour and Haraway to bear on environmental ethics discussions, especially around intrinsic and relational values. The work of Latour and Haraway expands the understanding of the more-than-human world, examines conceptions of nature and wilderness, looks at nature/culture interaction and proposes the inclusion of the Gaia and the Anthropocene as essential conceptual frameworks. Latour and Haraway’s work on relationality provides insight into the LFV. Latour’s actor-network theory increases the range of entities and objects that participate in networks and gives these actors greater agency. The concept of the Anthropocene means that relations between the human and the more-than-human have become central forces, and provides historical, political and economic background to the current ecological crisis. Acceptance of the Anthropocene and Gaia means that we exist in a limited critical zone. Latour and Haraway argue against universalizing ethical systems. Latour advocates ethical sensitization and Haraway argues for situated knowledge and attention to entanglement and injustice. The combination of these insights might be used to strengthen and improve the LFV.",Degree: MSc,PDF file (1039k),ETD,Unrestricted,System requirements: Adobe Acrobat Reader; PostScript compatible printer,,,MA
IR,MA,https://tinyurl.com/iresma2018,2018,45,https://sierra.ceu.edu/record=b1399037,http://www.etd.ceu.edu/2018/cakir_ozge.pdf ,"Cakir, Özge",Artificial intelligence and human security : understanding the role of human in contemporary warfare / Özge Cakir,"Budapest : Central European University, 2018",60 p. ; 30 cm.,CEU International Relations Department master theses ; 2018/14,English,"Throughout history, the nature of warfare has evolved in light of technological developments. The 21st century is witnessing rapid developments in artificial intelligence (AI) technology and their implications in the military sphere. The accelerating intelligence and autonomy that these developments provide the weapon systems are among the main features of the recent Revolution in Military Affairs (RMA). At the same time these features create a feeling of anxiety about the role of humans on the battlefield. This thesis seeks to scrutinize the main reasons behind the failure of the Critical Security Studies (CSS) scholars’ attempts to approach the altering nature of warfare and the role of human from a Human Security perspective. Therefore, it argues that in order to address the paradigm shifts in contemporary warfare and how it affects the role of humans on the battlefield successfully, Human Security should be re-connected with war-making. Instead of putting too much emphasis on drone warfare as the existing literature suggests, the more recent developments with the risk of eliminating humans from war-making should be addressed. Achieving a clearer understanding of what sort of motives that artificially intelligent units have would make it possible to control these motives. Thus, it would be possible for Human Security to successfully address the decreasing role of human in war-making.",Degree: MA,PDF file (944k),ETD,Unrestricted,System requirements: Adobe Acrobat Reader; PostScript compatible printer,,,MA
Philosophy,MA,https://tinyurl.com/philma2018,2018,9,https://sierra.ceu.edu/record=b1400148,http://www.etd.ceu.edu/2018/yu_yangsen.pdf ,"Yu, Yangsen",Conditional analysis and reason explanation / Yangsen Yu,"Budapest : Central European University, 2018",49 p. ; 30 cm.,CEU Philosophy Department master theses ; 2018/9,English,"In my thesis, I am going to argue against the idea that the conditional analysis and the reason explanation are completely different projects. I will say that the conditional analysis and the reason explanation share many similarities and by bridging the two, the two groups of theorists can enrich their respective accounts. I will first reject the simple version of conditional analysis for its own deficiency. I will also point out that despite the initial impression that they are different, conditional analysis and the reason explanation are actually both about semantics investigation. I will then argue that part of the conditional analysis of freedom can be made to be a reason explanation of action, because it contains enough information explain the action in question. Thus by bringing the two even closer.",Degree: MA,PDF file (840k),ETD,Unrestricted,System requirements: Adobe Acrobat Reader; PostScript compatible printer,,,MA
