department,program,lib_link,year,thesis_in_that_year,thesis_link,pdf_link,author,title,published,description,series,language,summary,note,filetype,localnote,access,systemdet,subject,alttitle,program_sampling,coder,folder_name
Nationalism,MA,https://tinyurl.com/natma2019,2019,18,https://sierra.ceu.edu/record=b1421284,http://www.etd.ceu.edu/2019/henic-sarajlic_ajla.pdf ,"Henić Sarajlić, Ajla",Enduring transition in Bosnia-Herzegovina : symbolic reparations for torture camp survivors case study of Prijedor / Ajla Henic Sarajlic,"Budapest : Central European University, 2019",88 p. ; 30 cm.,CEU Nationalism Studies master theses ; 2019/7,English,"In the wake of war, the victims who have been the target of past human rights violations, are in need of a collective societal response. In this regard, symbolic reparatory justice has become one of the mechanisms that can meet victims needs and sufferings. Concretely, dealing with memory in order to avoid denial and revisionism is essential for the process of healing not only for victims, but also for the political community it which they are ascribed. The purpose of the thesis is to focus the attention to the needs of torture survivors of Omarska, Keraterm and Trnopolje camps settled in 1992 in Prijedor during the Bosnian war. The main finding of the research is that, after more than twenty-five years, survivor’s sufferings remain still unaddressed and the concentration camps are unmarked. This demonstrates how Prijedor, BiH and the former Yugoslav sphere have not reconciled with its evil past. Hence, departing from the belief that an adequate post-conflict environment is essential for the healing of victims and survivors, the research conducted in-depth interviews for making an analysis of the actual demands on truth and justice for survivors in Prijedor.",Degree: MA,PDF file (930k),ETD,Unrestricted,System requirements: Adobe Acrobat Reader; PostScript compatible printer,,,MA,2,henic-sarajlic_ajla.pdf 
IR,MA,https://tinyurl.com/iresma2019,2019,40,https://sierra.ceu.edu/record=b1421589,http://www.etd.ceu.edu/2019/ilardo_matteo.pdf ,"Ilardo, Matteo Giuseppe",Corporate power analysis : a governmental approach to the study of the corporate social responsibility system of governance / Matteo Giuseppe Ilardo,"Budapest : Central European University, 2019",61 p. ; 30 cm.,CEU International Relations Department master theses ; 2019/21,English,"Multinational Corporations (MNCs) are tremendously involved into every major societal challenge of today. With governments struggling in addressing major global issues, society is now increasingly calling in the private sector to do so by asking for companies to promote positive social change. Corporate Social Responsibility (CSR) embodies this new position of business in society and makes corporations no longer mere objects of regulation but rather political actors themselves involved in the definition and establishment of rules and norms. The scope of this thesis is to investigate nature and scale of MNCs’ political authority in the international system through the analysis of the CSR regime to provide for a better understanding of these new forms of governance. Yet, for this to be possible, a context-specific study of power is needed. Following a power analysis in which different power considerations are connected to different possible reasons for MNCs’ compliance with socially-responsible policies, CSR is here interpreted as a system of self-discipline and conformity from which MNCs result being both empowered and constrained. CSR – a by-product of the broader neoliberal regime of governmentality – by redefining the boundaries between public and private, invests firms with political authority while at the same time reinventing their social role in a way that the resulting system of governance ultimately both governs through and consists of the very success of its discourse in the global economy.",Degree: MA,PDF file (682k),ETD,Unrestricted,System requirements: Adobe Acrobat Reader; PostScript compatible printer,,,MA,2,ilardo_matteo.pdf 
IR,PhD,http://tinyurl.com/h7m69ks, PhD (all years),25,https://sierra.ceu.edu/record=b1138148,http://www.etd.ceu.edu/2009/iphpon01.pdf ,"Popescu, Nicolae",Stealth intervention : the EU and post-Soviet conflicts   / Nicolae Popescu,"Budapest : Central European University, 2009",298 p. ; 30 cm.,CEU International Relations and European Studies Department PhD theses ; 2009/1,European Union countries -- Foreign relations -- Former Soviet republics,Former Soviet republics -- Foreign relations -- European Union countries,English,"This dissertation addresses EU policy towards the conflicts in Transnistria, Abkhazia, South Ossetia and Nagorno-Karabakh in the post-Cold War period. It examines the dynamics of EU interventions in conflicts, asking: Why and under what conditions does the EU decide to get involved in conflict resolution? In a conflict-prone world and competing security priorities, what determines EU involvement in particular conflicts? Do supranational institutions, such as the European Commission and the EU Council Secretariat, matter in initiating, shaping and implementing EU policies on conflict resolution? To answer these questions, I use institutionalist and intergovernmentalist theories to assess their relative explanatory power in accounting for the patterns of EU interventions in conflict. I find that these approaches are broadly complementary: institutionalism explains EU interventions in the low-politics areas of conflict resolution, while intergovernmentalism explains EU behaviour in the high-politics areas of intervention. When it comes to intervention in conflicts, EU foreign policy is like a light airplane: it can fly without being caught on radar as long as it flies ‘low’. By flying low (and slow), such an airplane can advance quite far into ‘enemy’ territory. However, if it increases its altitude above a certain threshold, it risks being detected by radars, and actions may be taken to halt the aircraft. The same holds true for EU interventions in conflicts. To avoid challenging EU member states, EU institutions often employ stealth intervention, operating predominantly in uncontroversial and depoliticised aspects of conflict resolution. By “flying low,” they are thus able to gradually extend their mandate from low-politics areas of conflict resolution to the high politics realm of overt intervention. Using a strategy I call “dosage”, EU institutions engage in a series of low-cost actions, which, over a longer period of time, can yield significant cumulated policy impact. However, if their involvement becomes suddenly controversial, as when EU institutions enter suddenly into the realm of high-politics, EU member states may move to limit their autonomy.  The dissertation traces the politics of stealth intervention by EU institutions using unpublished empirical data related to the EU decision-making process as well as interactions between the EU institutions, EU member states, and Russia in the conflict zones in question.",Degree: PhD,PDF file (306k),ETD,European Union -- Former Soviet republics,,PhD,2,iphpon01.pdf 
Gender studies,MA,https://tinyurl.com/genderma2018,2018,29,https://sierra.ceu.edu/record=b1400164,http://www.etd.ceu.edu/2018/kasdovasili_stella.pdf ,"Kasdovasili, Stella Andrada","Drag-ing the human out of the human-oid : reflections on artificial intelligence, race and sexuality in late capitalism / Stella Andrada Kasdovasili","Budapest : Central European University, 2018",73 p. ; 30 cm.,CEU Gender Studies Department master theses ; 2018/14,English,"This thesis seeks to explore they ways in which the category of human formulates the research in the field of Artificial Intelligence by examining the boundaries introduced by the distinction between human and non-human. My research is focused on the case study of Sophia, a humanoid manufactured by Hanson Robotics that obtained citizenship from Saudi Arabia, in October 2016. Considering the ways through which the humanoid becomes sexualized and racialized, I will argue that Sophia enfolds the potentiality of subversion, that is of interest for feminist epistemology. In the theoretical framework of the first chapter, I will provide the reader with a genealogy of the category of human by focusing on the canonical patriarchal understanding of the rational man in Western philosophy, while also addressing the category of human species, so as to illustrate how these approaches formulated research in Artificial Intelligence. In the second chapter, I will provide a close reading analysis of Michel Foucault and Brian Massumi’s scholarship that bridges biopower and capitalism to the affect and the body’s materiality. Based on this, I will read the trope of emotionality used in Sophia’s case in relation to the modulation of affect in late capitalism. This way, I intend to illustrate how Sophia is imbedded in a much more nuanced web of relations of power, one that redefines the boundaries between who is included in the category of the human species and who is not. In the third chapter, by employing Michel Foucault’s analysis on biopower while also engaging with Norman Fairclough’s critical discourse analysis I will draw attention to the discursive traces that construct Sophia’s identity in accordance to the biopolitical technologies of race and sexuality. Finally, in last chapter, drawing on Gilles Deleuze and Felix Guattari’s analysis on the abstract machine of faciality and Judith Butler’s approach on drag I will reflect on the constructiveness of the boundaries between the human and the non-human, to argue that Sophia is not just a product of her time but also a point of disruption that might unravel what Deleuze and Guattari call, the inhuman in the human.",Degree: MA,PDF,ETD,Unrestricted,System requirements: Adobe Acrobat Reader; PostScript compatible printer,,,MA,2,kasdovasili_stella.pdf 
Economics,Business,https://tinyurl.com/ecobus2018,2018,26,https://sierra.ceu.edu/record=b1410991,http://www.etd.ceu.edu/2018/kelemen_andras.pdf ,"Kelemen, Andras Gabor",Time series forecasting for Archipelago International / Andras Gabor Kelemen,"Budapest : Central European University, 2018",10 p. ; 30 cm.,CEU Economics and Business Department master theses ; 2018/9,English,"Time Series Forecasting for Archipelago International, Indonesiaâ€™s largest operator of hotels. Historical data analysis using statistical modeling, regression and other machine learning models to eventually come to an accurate occupancy prediction.",Degree: MSc,PDF file (522k),ETD,Capstone  project,Unrestricted,.,,Business,2,kelemen_andras.pdf 
Environmental sciences,PhD,http://tinyurl.com/cd675h,PhD (all years),48,https://sierra.ceu.edu/record=b1173902,http://www.etd.ceu.edu/2014/khan_fouad.pdf ,"Khan, Fouad Muhammad",Scaling in cities as an indicator of energy consumption : what fractal analysis could tell us about resilience and disparity in complex systems  / Fouad Muhammad Khan,"Budapest : Central European University, 2014",187 p. ; 30 cm.,CEU Department of Environmental Sciences & Policy PhD theses;   2014/1,Climatic changes,PDF file (3445k),English,Degree: PhD,"Climate change and global resource extraction peaks are problems that may require a complete overhaul of the fundamental paradigms of our civilization in order to be solved. Paradigm changes are implemented in societies first and foremost through a redefinition of indicators. Our current indicator systems do not take into account the complexity of human social, economic and material systems and prioritize “efficiency” and “growth”. The objective of this research was to develop an indicator for one type of anthropogenic complex systems, i.e. cities that took into account the complex nature of the system and provided a quantitative way to prioritize alternative values such as “resilience” and “sustainability”. Scaling has been identified as one measure of complexity in a system, which is relatively easy to compute and comprehend. Here, I have developed a scaling indicator for cities based on fractal dimension. US block wise census data was used to calculate the exponent of the power-law distribution of population density across different census blocks in a city. The power-law, or scaling indicator, herein referred to as the fractal dimension was then compared to parameters such as population, area, population density, gasoline sales, gasoline sales per capita and area, and carbon emissions and carbon emissions per capita. It was noted that the fractal dimension had a power-law correlation with gasoline sales per unit area in the cities. The analysis was then extended a second complex system, i.e. national economies. Fractal dimension or scaling of percentages of incomes across the highest earning to lowest earning twenty percent segments of the population was calculated using World Bank economic data for 2004 (the year for which most extensive dataset was available). The relationship between this scaling indicator and energy usage per capita in countries was again found to be a power-law with an r-square value of more than 0.35 (similar to the correlation between urban fractal dimension and gasoline sales per area in cities). A new planning tool is developed to allow incorporation of consideration of these complexity indicators in development planning for cities and national economies. The planning-plane allows for visualization of the impacts of particular interventions in cities (e.g. housing scheme) and economies (e.g. changes in tax-code) on energy consumption parameters across two independent variables (e.g. population and fractal dimension) instead of the usual practice of using one indicator (e.g. population density). The similar nature of the correlation between scaling indicators and energy consumption indicators in two completely different anthropogenic complex systems hints at some underlying similarity in the mechanism through which these complex systems develop. It is hypothesized here that steeper scaling (e.g. higher income differences in economies) in complex systems makes good system regulation more energy intensive, thereby affecting the energy consumption parameters as observed in this study. Steeper scaling also thus negatively affects the effectiveness of regulation in complex systems and makes the system more prone to internal shocks. Planning system evolution for resilience would thus benefit from consideration of scaling indicators in the planning process.",ETD,Unrestricted,City planning -- Environmental aspects,,PhD,2,khan_fouad.pdf 
Gender studies,MA,https://tinyurl.com/genderma2019,2019,35,https://sierra.ceu.edu/record=b1424390,http://www.etd.ceu.edu/2020/khan_shehreen.pdf ,"Khan, Shehreen Ataur","Bangladeshi food voices from diaspora : narratives of six case studies from the UK, USA and Hungary  / Shehreen Ataur Khan","Budapest : Central European University, 2019",119 p. ; 30 cm.,CEU Gender Studies Department master theses ; 2019/35,English,"This thesis is focused on Bangladeshi culinary representations in the diaspora. The purpose of this research is to gain a better understanding of the Bangladeshi migrants who are involved in the culinary industry. I joined these two strands together and formed the kernel of my dissertation, which is to examine the layers of Bangladeshi migrant identities that are orchestrated through their culinary expressions in diaspora. My dissertation is based on six case studies from the UK, USA, and Hungary. Because of the diverse backgrounds of the case studies, there was an eclectic mix in their culinary projects, and I have analyzed them through the theoretical lens of food histories, food narratives, postcolonial studies, migrant identifies, and oral history. This research reveals how their culinary projects are coming to terms with a new reality, an expression of their hybrid identity, and at the same time, celebrating the connection with their homelands.",Degree: MA,PDF,ETD,Unrestricted,System requirements: Adobe Acrobat Reader; PostScript compatible printer,,,MA,2,khan_shehreen.pdf 
Political science,PhD,http://tinyurl.com/asr6lx, PhD (all years),77,https://sierra.ceu.edu/record=b1175397,http://www.etd.ceu.edu/2014/kiss_agnes.pdf ,"Kiss, Ágnes","Censorship between ambiguity and effectiveness : rules, trust and informal practices in Romania (1949-1989) / Ágnes Kiss","Budapest : Central European University, 2014",260 p. ; 30 cm.,CEU Political Science Department PhD theses ; 2014/2,Censorship -- Romania,English,"In this dissertation, I present and discuss in detail the underlying formal organizational solutions and everyday informal practices contributing to the effective implementation of ambiguous censorship norms. Notwithstanding the persistent interest in the study of state censorship, the aspect that certain levels of coordination have to occur under invariably vague regulations is surprisingly neglected. Yet, given the role played by censorship in sustaining non-democratic regimes, the Soviet-type for instance on which the present analysis is centered, how the system internally managed to deal with uncertainties concerning censorship norms, and how the main actors coped with it, is surely a pertinent question. The research was designed to address both formal and informal aspects of the censorship process. For assessing formal organizational solutions, I use mid-level theories developed in the vein of the structural contingency approach to organizational design, whereas for the study of informal practices, I draw on theoretical insights offered by the comparative political science literature and a conceptual typology of informal practices/institutions that I developed based on three typologies (Nee and Ingram 1998, Lauth 2000, Helmke and Levitsky 2006a). In terms of methods, I combine institutional analysis and historical ethnography, which involves processing data derived from official documents and subjective sources (interviews, memoirs, diaries and contemporary correspondence). The empirical analysis is based on a single case, that is, the Romanian censorship system in the state socialist period (1949–1989). Within the case, the focus on formal mechanisms is narrowed to the extreme end of the pre-publication procedure, the activity of local censors’ offices namely. With regards to informal mechanisms, the analysis is focalized on positive interpersonal relationships between the actors of the censorship system, particularly those nurtured among the controllers and controlled, and the allied informal practices. The intensive analysis of the Romanian case resulted that the effective implementation of the censorship policy was maintained by a complex set of formal organizational coordination and control mechanisms that were appropriately designed to meet critical contingencies (i.e. task uncertainty), as well as by various types of informal practices based on trust-centered interpersonal ties. The types of informal practices that furthered the formal scopes of censorship include the spread and clarification of information regarding censorship norms via peers and censors (complementary informal practices), censors sharing confidential directives (accommodating practices), as well as counseling and ensuring with controllers prior to official checking (substitutive practices). The fourth type comprises interactions that eventually undermined the effectiveness of the censorship policy, practices such as negotiations between the censors and editors-in-chief/authors, intervening through personalized networks on behalf of a publication, or taking a risk by turning a blind eye to problematic issues (competing of practices). These findings complement accounts of the functioning and effectiveness of the Soviet-type censorship system primarily focused on macro institutional and organizational configurations. Furthermore, the results shed light on practices constituting the domain of “self-censorship”, which is also claimed by the literature to represent an important factor contributing to the effectiveness of censorship. Finally, by focusing on positive interpersonal ties and related practices, the findings considerably alter the dominant narrative centered on negative relationships between the controllers and the controlled, yet they also show that many interactions based on positive ties had the same effects as their negative counterparts: raising the performance of the censorship system.",Degree: PhD,PDF file (2650k),ETD,Unrestricted,"CEU Doctoral School of Political Science, Public Policy and International Relations",,PhD,2,kiss_agnes.pdf 
Legal studies,MA,https://tinyurl.com/legalma2019,2019,50,https://sierra.ceu.edu/record=b1420057,http://www.etd.ceu.edu/2019/kvaratskhelia_gvants.pdf ,"Kvaratskhelia, Gvantsa",Constitutionality of delegated legislative powers to the executive / Gvantsa Kvaratskhelia,"Budapest : Central European University, 2019",43 p. ; 30 cm.,CEU Legal Studies Department master theses ; 2019/15,English,"The thesis focuses on constitutional standards over delegation of the legislative powers to the executive. In modern industrial states the executive’s law-making power is increased. It is regarded as practical and effective way to govern the state without impediments. However, constant practice of the delegation may cause erosion of basic constitutional principles, such as separation of powers, checks and balances and rule of law. Erosion of parliament’s rule-making function consists threat against democracy. Thesis enquires those constitutional limits that are protected in case of permitting the legislative delegation.",Degree: MA,PDF file (615k),ETD,Unrestricted,System requirements: Adobe Acrobat Reader; PostScript compatible printer,,,MA,2,kvaratskhelia_gvants.pdf 
Political science,MA,https://tinyurl.com/polma2020,2020,42,https://sierra.ceu.edu/record=b1427942,http://www.etd.ceu.edu/2020/lazarescu_paul.pdf ,"Lazarescu, Paul Manuel",Understanding the implications of the Hart-Celler Act / Paul Manuel Lazarescu,"Budapest : Central European University, 2020",54 p. ; 30 cm.,CEU Political Science Department master theses ; 2020/9,English,"The Hart-Celler Act, formally known as the Immigration and Nationality Act of 1965, has had a thought-provokingly stellar impact on U.S. immigration. This act eliminated discrimination against certain ethnic groups that had persisted since the Immigration Act of 1924 which established the National Origins Formula. Under the National Origins Formula, immigration quotas were put into place in order to limit the number of immigrants from regions of the world that would negatively alter the ethnic distribution of the United States. The era within which the Hart-Celler Act was passed was one of a great change in the psyche of the U.S. demos towards a more liberal, global way of thinking by removing these quotas and creating a better system through which residency could be acquired. The changing of times and inability to address it since, however, has led to immigration becoming a forefront of political debate in the United States today. This has culminated in the presidential campaign and subsequent election of Donald J. Trump, whose primary campaign issue revolved around racially charged sentiments and the problems of immigration. My aim here is to assess, from relevant data and evidence, the impact of the Hart-Celler Act by examining a) how it improved or faulted as legislation upon its predecessor – via reallocation of immigration slots from Northern Europe to 3rd world inhabitants or the creation of chain migration – and b) the economic and social consequences that have occurred in the fifty years following. I shall follow this up by developing a normative scale upon which to judge the competing immigration theories, which is succeeded by taking a look at philosophical literature in search of providing a clearer picture regarding the moral debate surrounding immigration today. I conclude a) that Congress passed a law improving on many of the shortcomings of its predecessor, though it has not been spared criticism on pragmatic grounds; and b) that the legislative changes cultivated fairly positive economic consequences. Additionally, I assert that sole adherence to either theory of immigration is too narrow in approaching the problem of reform and that collaborative measures that are understanding of both sides’ interpretations of justice is the most suitable path forward.",,PDF file (924k),ETD,Unrestricted,System requirements: Adobe Acrobat Reader; PostScript compatible printer,,,MA,2,lazarescu_paul.pdf 
