department,program,lib_link,year,thesis_in_that_year,thesis_link,pdf_link,author,title,published,description,series,language,summary,note,filetype,localnote,access,systemdet,subject,alttitle,program_sampling,flag,coder
Medieval studies,PhD,http://tinyurl.com/c9f9lq, PhD (all years),43,https://sierra.ceu.edu/record=b1204418,http://www.etd.ceu.edu/2017/orban_aron.pdf ,"Orbán, Áron",Born for Phoebus : solar-astral symbolism and poetical self-representation in Conrad Celtis and his humanist circles  / Áron Orbán,"Budapest : Central European University, 2017",304 p. ; 30 cm.,CEU Medieval Studies Department PhD theses ; 2017/2,CEU Doctoral School of History,DOI: 10.14754/CEU.2017.01,"Fifteenth-sixteenth-century Germany – and Renaissance Europe in general − witnessed a growing interest in natural philosophy (including occult disciplines), the laws of nature, and the correspondences between micro- and macrocosm. On the other hand, the enhanced self-consciousness or even pride of the Renaissance author compared to that of the earlier medieval one is a long established commonplace; indeed, humanist poets were inclined, in varying degrees, to self-fashioning, self-mythologizing. My interdisciplinary study focuses on the junction of these two basic habits of mind of German humanists around 1500. I reveal solar and astral (mainly astrological) symbolism in Neo-Latin poetical works and visual artworks of this period, and investigate how this cosmic symbolism was used for self-representative purposes. Among the German humanists I focus on Conrad Celtis (1459-1508), the “„arch-humanist” of Germany, the first poet laureate of his nation, the ""bringer of the muses"" to the German land. Celtis's personality, poetic talent, ambition, scientific-philosophical interests, his assumed role − all this resulted in various interesting ways of ""cosmic"" self-representation; I argue that this is a core area of his whole poetical oeuvre. In the investigated period of German humanism (c. 1485-1510), some other poets who were friends of Celtis also employed astronomical, astrological, cosmological imagery in the construction of their (or the group's) humanist identities, in various ways, to various extent: Jakob Locher, Laurentius Corvinus (Rabe), Johannes Tolhopf, Augustinus Moravus; I involve in my research representative works of these authors, too. The first chapter reviews the poetological background of the enhanced vates-ideology of the German humanists: the humanist revaluation of poetry in the Renaissance and the “„defense of poetry” tradition. The second chapter overviews Celtis’s ideas about astronomy-astrology, micro- and macrocosm in general. Chapters 3-6 explore Celtis’s and his firends’ strategies of “„cosmic” self-representation through analyses of specific works. Humanists could support their vates-role by means of their (idealized) birth horoscope or the horoscope of laureation (ch. 3-4); or they could develop a complex Phoebean symbolism based on Phoebus, the solar god who supports the poet in various ways (ch. 5). Humanist group-identity could be strengthened through a Phoebean-Bacchic symbolism and the mythologizing of humanist feasts (ch. 6).",Degree: PhD,PDF file (9848k),ETD,Unrestricted,,,PhD,0,1
Environmental sciences,PhD,http://tinyurl.com/cd675h,PhD (all years),48,https://sierra.ceu.edu/record=b1246111,http://www.etd.ceu.edu/2016/winter_amanda.pdf ,"Winter, Amanda Kay",Contested sustainability and the environmental politics of green city making / Amanda Kay Winter,"Budapest : Central European University, 2016",266 p. ; 30 cm.,CEU Department of Environmental Sciences & Policy PhD theses;   2016/4,Urban planning,Architecture,Environmental policy,Sustainable development,English,Degree: PhD,PDF file (5308k),City planning,,PhD,0,1
IR,MA,https://tinyurl.com/iresma2018,2018,45,https://sierra.ceu.edu/record=b1399014,http://www.etd.ceu.edu/2018/aslantepe_goknur.pdf ,"Aslantepe, Göknur",Women politicians of a masculine state : gendered politics in Turkey / Göknur Aslantepe,"Budapest : Central European University, 2018",53 p. ; 30 cm.,CEU International Relations Department master theses ; 2018/3,Women -- Turkey -- Political activity,English,The thesis examines the masculine character of the branches of government of Turkey. Theoretical framework of the thesis is based on feminist international relation theory. Thesis demonstrate the futures of male-dominated politics by investigations historical process of women and current conditions of women politicians in political institutions of Turkey.,Degree: MA,PDF file (835k),ETD,Unrestricted,Women in politics -- Turkey,,MA,0,1
Sociology,MSc,https://tinyurl.com/socma2018,2018,22,https://sierra.ceu.edu/record=b1399149,http://www.etd.ceu.edu/2018/castillo_sidney.pdf ,"Castillo Cardenas, Sidney Alberto",(Not) the fate of our fathers : a social and cognitive approximation to the changing religious landscape in Peru among young adults / Sidney Alberto Castillo Cardenas,(Not) the faith of our fathers : a social and cognitive approximation to the changing religious landscape in Peru among young adults,"Budapest : Central European University, 2018",57 p. ; 30 cm.,CEU Sociology Department master theses ; 2018/2,English,"A major change in the contemporary global religious landscape is currently in progress, and Peru is not a stranger to it: the rise of the religious nones and unaffiliated, the incidence of religious institutions or groups in local politics as part of transnational efforts, and the emergence of ever-evolving nuanced religiosities have been also part of Peruvian daily life for the past 25 plus years. Such general process, defined by a departure from exclusively institutional religious worldviews towards more diverse ones, is in tune with what occurs at the latin american/regional and local levels; and yet at the same time it’s also far from being homogeneous to all social realities in which it takes place, as the Peruvian case provides also with examples. Given this contrasting relationship between the local and the global, it is worth questioning as to what is the cause (or causes) attributable for these shared differences in form, but not in content. In the present thesis, I will address this question in arguing that religious socialization experiences, in the form of Credibility Enhancing Displays (CREDs onwards), are one of the main conditioners for shaping contemporary Peruvian religious and secular worldviews. CREDs are related to instances of observable behavior from an individual’s peers that generate an impact on them, based on how they act accordingly to what is stipulated in their respective religious belief systems or expressed religious convictions. In turn and over time, different CREDs will allow for the acquisition, maintenance or relegation of religious belief and their negotiations, which give rise to diversified worldviews.  For this purpose, I have placed as unit of analysis the age group of Peruvian young adults, (18-29 y.o.) all of them being university students located in Lima-Peru, since, as it will be argued, Peruvian youth within this age group experiences religious socialization in differentiated ways to previous generations, namely, in their general socialization experiences; in the accessing of novel media elements; in the engagement of social movements; and, in the adoption of a consumer ethos.  An interdisciplinary theoretical and methodological approach will be the basis for the elaboration of the argument, in which concepts from the fields of Cognitive Science of Religion and Sociology (in the form of theories of religious socialization) will serve as analytical tools; while grounded techniques based on Q-methodology have been used for the data gathering process of 320 surveys, 43 q-sorts, and 43 structured interviews. As a result of this exploration, a preliminary proposal of ideal-type models of religious and secular worldviews will be outlined. With this exercise, my thesis expects to contribute, not only to the study of contemporary religious worldviews but as an effort for interdisciplinary dialogue between disciplines and fields of research.",Degree: MA,PDF file (864k),ETD,Unrestricted,,,MA,0,1
Sociology,MSc,https://tinyurl.com/socma2018,2018,22,https://sierra.ceu.edu/record=b1399180,http://www.etd.ceu.edu/2018/barmina_alexandra.pdf ,"Barmina, Alexandra",Labor under authoritarian neoliberal regime : work experiences of independent journalists in Russia / Alexandra Barmina,"Budapest : Central European University, 2018",63 p. ; 30 cm.,CEU Sociology Department master theses ; 2018/11,English,"This study analyzes labor experiences and subjectivities of independent journalists in Russia as conditioned by the specific mode of authoritarian neoliberal regime. While current labor studies focus mostly on the impact of neoliberalization on labor, this thesis demonstrates that experiences of workers, engaged in cultural production in authoritarian states, are conditioned by the state’s endeavor at reproduction of symbolic order and marginalization of those in conflict with the hegemonic state project as well. For this reason, labor of journalists under authoritarian neoliberal regime is characterized as “politically” and “economically” precarious, and these two dimensions of precarity are closely intertwined. Journalists simultaneously face lack of stable contracts, employment insecurity, menace of media outlets being shut-down and even life threat. This research discusses how independent journalists in Russia experience and articulate these insecurities, related to specific economic and political contexts in which their labor is placed. The thesis demonstrates that political dimension of precarity, engendered by the authoritarian regime, is treated by journalists as the most problematic, whereas economic insecurities, albeit solidly present, tend to be ignored. Among the reasons for non- acknowledgement of the economic dimension of precarity are specific understanding of labor journalists share, their liberal ideologies, strong affective bindings to a job, widespread among cultural workers, and privileged class positions. Perception of political insecurities as the dominant threat also contributes to disregard of poor formal labor conditions.",Degree: MA,PDF file (547k),ETD,Unrestricted,System requirements: Adobe Acrobat Reader; PostScript compatible printer,,,MA,0,1
Sociology,MSc,https://tinyurl.com/socma2018,2018,22,https://sierra.ceu.edu/record=b1399301,http://www.etd.ceu.edu/2018/younes_racha.pdf ,"Younes, Rasha","""Toeing the sectarian line "" : negotiations between the spatial, economic, and ideological consumption and production of counter-hegemonic resistance for ""Beirut Madinati"" / Rasha Younes","Budapest : Central European University, 2018",71 p. ; 30 cm.,CEU Sociology Department master theses ; 2018/22,English,"This thesis begins by situating political sectarianism, in its complex systems of operation, as the historical hegemony around which Lebanese civil society congregates to make meaning of its own discord and create possibilities for alternative ideology. I depart from a Gramscian analysis of sectarianism as a historically and politically situated power-sharing mechanism wielded by Lebanese political elites to determine and perpetuate the economic, social, and ideological positions of their members. Within a dialectical framework of resisting sectarianism through political participation, I investigate the possibilities of emergence and conditions of resistance for counter-hegemonic movements in Lebanon. Drawing on ethnographic fieldwork conducted in Beirut, I mobilize the case study of the self-proclaimed counter-sectarian civil society movement “Beirut Madinati.” In particular, by interrogating the inner-workings of “Beirut Madinati,” I argue that this oppositional movement’s ability to resist is hinged on its access to and consumption of a neoliberal sectarian space, economy, and formal discourse, which led to its counter-hegemonic paralysis. Vis-à-vis the case of counter-sectarianism in Beirut, I conclude by emphasizing that instead of focusing solely on the conceptual ideological terrain of resistance, it is imperative to re-imagine scholarly and activism connotations of resistance to include its pragmatic materialization in its situated spatial context.",Degree: MA,PDF file (1334k),ETD,Unrestricted,System requirements: Adobe Acrobat Reader; PostScript compatible printer,,,MA,0,1
Legal studies,MA,https://tinyurl.com/legalma2018,2018,60,https://sierra.ceu.edu/record=b1399530,http://www.etd.ceu.edu/2018/simic_nemanja.pdf ,"Simic, Nemanja",Following the US approach on private equity structures in Serbia / Nemanja Simic,"Budapest : Central European University, 2018",71 p. ; 30 cm.,CEU Legal Studies Department master theses ; 2018/28,English,"Private equity is a concept that encompasses many related disciplines, like business, economy, financing, management, etc. This thesis aims to provide a clear overview of one of its layers â€“ the legal one. Out of several branches of law affected by this concept, the research will focus primarily on structuring, i.e. on the choices of corporate vehicles for business operations and legal consequences that such choices brings with them. In addition, special attention will be paid to tax considerations of such options as they by default heavily affect both the choice of business vehicles and operations of private equity industry in general. The primary reason for making such analysis lies in the fact that up to date scholarly works on legal aspects of private equity in Serbia are essentially descriptive. They do not give the answer as to why private equity industry in the country has not made a substantial progress for more than a decade after its regulation. Nor do they establish a comparative model upon which the industry can look upon. In this research, it is suggested that the US system may serve as such model. For these purposes, it explores the characteristics of the US system and the options it offers. The thesis will conclude that having a choice between several business vehicles and tax treatments is beneficial for the development of private equity industry in a country. Notably, the system needs to provide the possibility for private equity funds and firms to operate as flexible entities that are also fiscally transparent. This conclusion outlines the need for the developing countries to constantly reexamine their approach when it comes to the legal treatment of private equity. Overall, the research shows that civil law systems have many lessons to adopt from the American experience with the regulation of private equity industry. Out of it also comes the recommendation for future scholarly works on alternative models for the development of the industry in Serbia.",Degree: MA,PDF file (785k),ETD,Unrestricted,System requirements: Adobe Acrobat Reader; PostScript compatible printer,,,MA,0,1
Political science,MA,https://tinyurl.com/polma2018,2018,43,https://sierra.ceu.edu/record=b1399916,http://www.etd.ceu.edu/2018/poltoratskaya_vikt.pdf ,"Poltoratskaya, Viktoriia",Accountability of federal systems : factors of budgetary performance in Russia and Germany  / Viktoriia Poltoratskaya,"Budapest : Central European University, 2018",64 p. ; 30 cm.,CEU Political Science Department master theses ; 2018/28,English,"This work is devoted to the analysis of two federations - Germany and Russia in the period from 1991 to 2016. This research is answering the question why, despite the existing legacy of federative relations with the substantial level of decentralization and accountability with democratic traditions German regions does not show good budgetary performance, whereas in the absence of historical legacy and accountability mechanisms and with the high level of political centralization in Russia, it is possible to create system with the better budgetary performance. The hypothesis of this research was that indeed, the historical heritage and democratic rules increase the level of decentralization and accountability, but this does not necessarily lead to better budgetary performance because of the weak budgetary constraints and incentives. The results of this study approve this hypothesis. Tested by crisp-set Qualitative Comparative analysis this research shows several important tendencies. Despite of the historical roots, federal legacy and democratic type of regime leading to a greater level of decentralization, budgetary performance is not a direct consequence of such a system. With a relatively high level of decentralization, many of Germany's decentralization mechanisms work towards a worse performance. In particular, a strong level of fiscal decentralization, a lack of transparent budgetary allocation mechanisms (which are mainly related to the type of parliamentary political system), and a large number of equalizing federal transfers together with an uncontrolled regional opportunity to borrow money lead to a worse budgetary performance in that country. On the other hand, a more centralized system with lower level of accountability more often shows the better results in terms of budgetary performance, although some centralization tendencies (primarily political ones) do not contribute to the best level of budgetary indicators. Thus, the main conclusion of this work that hard budget constraints together with transparent responsibilities division allow a higher level of budgetary performance in Russia and Germany. These findings contribute to the literature on political economy of federal systems.",,PDF file (987k),ETD,Unrestricted,System requirements: Adobe Acrobat Reader; PostScript compatible printer,,,MA,0,1
Political science,MA,https://tinyurl.com/polma2018,2018,43,https://sierra.ceu.edu/record=b1399921,http://www.etd.ceu.edu/2018/shishov_aleksandr.pdf ,"Shishov, Aleksandr",Identifying the Heideggerian footprint in post-communist Russia's radical political thought / Aleksandr Shishov,"Budapest : Central European University, 2018",61 p. ; 30 cm.,CEU Political Science Department master theses ; 2018/33,English,"At present, despite significant interest in Russian politics and its benchmark status for claims regarding the rise of illiberal tendencies, very little is done to investigate the developments within Russia’s eclectic philosophical landscape. This paper examines the political theory of one the most controversial and curious Russian intellectuals - Aleksandr Dugin. In his key work “The Fourth Political Theory” Dugin dismisses liberalism, communism and fascism and proposes an approach to political philosophy that, according to his argumentation, fosters an authentic relationship with Being by conceptualising Heidegger’s category of Dasein as the subject of politics. This paper suggests that Dugin’s theory constitutes a genuine and unique example of Right-Heideggerianism and expands on the ideas of conservative revolutionaries through incorporating the major theoretical developments of the 20th century. It is demonstrated that identifying the key premise of Dugin’s approach to political philosophy as the insistence on the ontological primacy of community in relation to the construction of the human self, envisioned in Heideggerian terms, allows for Dugin’s political application of Heidegger’s fundamental ontology to be both sufficiently distinct from present currents in political thought, and flexible to be appropriated as a new conceptual foundation by a wide array of radical conservative and right-wing movements.",,PDF file (884k),ETD,Unrestricted,System requirements: Adobe Acrobat Reader; PostScript compatible printer,,,MA,0,1
Political science,MA,https://tinyurl.com/polma2018,2018,43,https://sierra.ceu.edu/record=b1399930,http://www.etd.ceu.edu/2018/toth_gergo.pdf ,"Tóth, Gergő",Social interaction as cues : a low-cost tool for changing political opinion / Gergő Tóth,"Budapest : Central European University, 2018",67 p. ; 30 cm.,CEU Political Science Department master theses ; 2018/42,English,"Social science literature has long investigated the relationship between political behavior and social networks, however, it is usually hard to excavate a true causal relationship between political views and social affiliations. The common feature of political science literature related to a social network is that they mostly focus on whether the individuals’ political views and their social networks co-evolve or not. According to the recent literature, social networks do not simply evolve but also stimulate our political behavior. Most of the literature finds that people seek individuals with similar political views to be friends with and individuals who often talk to each other tend to be more similar over time Although there is broad agreement on that while our social network is dynamically flourishing, it is also affecting our attitude, but the process of this impact is still not clear. This research aims to examine the channel between social affiliations to the changes of political behavior. The research uses network data collected from experiments to specify the social affiliation effects on the change of political views under a deliberation process. The results suggest that, on the one hand, political opinion significantly influences friendship network formation, which fosters social homophily. On the other hand, a significant spillover effect has found on the likelihood of political opinion change, where the spillover effect strongly depends on the peers’ network centrality.",,PDF file (1517k),ETD,Unrestricted,System requirements: Adobe Acrobat Reader; PostScript compatible printer,,,MA,0,1
Economics,MA,https://tinyurl.com/ecoma2018,2018,52,https://sierra.ceu.edu/record=b1399992,http://www.etd.ceu.edu/2018/pitia_modi.pdf ,"Pitia, Modi Denis Elikana",Could lack Of Central Bank independency result into hyperinflation case study : South Sudan  / Modi Denis Elikana Pitia,"Budapest : Central European University, 2018",70 p. ; 30 cm.,CEU Economics Department master theses ; 2018/33,English,"South Sudan is one of the newest country in the globe and Africaâ€™s 55th nation that got its independence on 9, July 2011 after a long civil war that lasted for more than twenty-five years. After gaining independence South Sudan economy has been faced with a number of challenges as the government tries to implement its development objectives. On 11 November 2013, the Central Bank of South Sudan made changes to its official exchange rate which was initially pegged to United States dollar by devaluing its currency by 42% and further by 84% in 2015. This act resulted into general increase in the prices of goods and services since the country is import dependent to a large extent. This research paper will try to understand whether the currency devaluation could be a lead cause towards the increased inflation and even hyperinflation in the country. Secondly, the research will also try to investigate the extent to which Central Bank is independent and how the lack of independence helped the emergence of hyperinflation in South Sudan. The research will also try to analyze the inflationary historical aspects of the East African region based on the precolonial and postcolonial times so as to examine other factors that might have caused inflation in the region while addressing the economic growth challenges. The research will also take into consideration a theoretical overview of Sudan and South Sudan economy before and after independence since these two countries were once one. The research paper will finally draw conclusion from different views while trying to investigate the impact of Central Bank independence and currency devaluation in relation to causes of hyperinflation in South Sudan. Suggested policy recommendation will be provided for policy makers.",Degree: MA,PDF file (1814k),ETD,Unrestricted,System requirements: Adobe Acrobat Reader; PostScript compatible printer,,,MA,0,1
Philosophy,MA,https://tinyurl.com/philma2018,2018,9,https://sierra.ceu.edu/record=b1400148,http://www.etd.ceu.edu/2018/yu_yangsen.pdf ,"Yu, Yangsen",Conditional analysis and reason explanation / Yangsen Yu,"Budapest : Central European University, 2018",49 p. ; 30 cm.,CEU Philosophy Department master theses ; 2018/9,English,"In my thesis, I am going to argue against the idea that the conditional analysis and the reason explanation are completely different projects. I will say that the conditional analysis and the reason explanation share many similarities and by bridging the two, the two groups of theorists can enrich their respective accounts. I will first reject the simple version of conditional analysis for its own deficiency. I will also point out that despite the initial impression that they are different, conditional analysis and the reason explanation are actually both about semantics investigation. I will then argue that part of the conditional analysis of freedom can be made to be a reason explanation of action, because it contains enough information explain the action in question. Thus by bringing the two even closer.",Degree: MA,PDF file (840k),ETD,Unrestricted,System requirements: Adobe Acrobat Reader; PostScript compatible printer,,,MA,0,1
