department,program,lib_link,year,thesis_in_that_year,thesis_link,pdf_link,author,title,published,description,series,language,summary,note,filetype,localnote,access,systemdet,subject,alttitle,program_sampling,coder,folder_name
Political science,MA,https://tinyurl.com/polma2018,2018,43,https://sierra.ceu.edu/record=b1399887,http://www.etd.ceu.edu/2018/davidovic_jovana.pdf ,"Davidovic, Jovana",Unraveling the Black Mountain : authoritarian submission and party preference in Montenegro / Jovana Davidovic,"Budapest : Central European University, 2018",91 p. ; 30 cm.,CEU Political Science Department master theses ; 2018/6,English,"Why some post-communist countries regularly experience democratic overturn of power while others not? Concentrating on the psychological factors that could prevent democratic competitiveness in post-communist area, this thesis investigates the relationship between one particular dimension of authoritarian personality – authoritarian submission, and party preferences in Montenegro - the country that never changed the incumbent government since the breakdown of communism. I adopt a novel approach to tap into the multi-dimensional examination of authoritarianism, concentrating on three dimensions (authoritarian submission, conventionalism, authoritarian aggression) separately. I argue that authoritarian submission, as a psychological construct that stands for obedient relation to political authority and upbringing patterns, has a potential to explain domination of Democratic Party of Socialists – DPS. I test my assumptions using survey research. More precisely, I use two surveys – Montenegrin National Elections Study (2016) – MNES, and a self-designed student survey (2018). Notwithstanding the Montenegrin/Serb ethnic cleavage that remains significant, findings from both analyses confirm that submissive tendencies are relevant for voting this party, thus emphasizing the relevance of psychological factors for the democratic potential of post-communist countries.",,PDF file (1630k),ETD,Unrestricted,System requirements: Adobe Acrobat Reader; PostScript compatible printer,,,MA,2,davidovic_jovana.pdf 
Gender studies,MA,https://tinyurl.com/genderma2020,2020,26,https://sierra.ceu.edu/record=b1429187,http://www.etd.ceu.edu/2021/dumitru_maria.pdf ,"Dumitru, Maria Georgiana",Multiple discrimination and untold stories of resistance : a case study of Romanian Roma women conducting informal street work in Oslo / Maria Dumitru,"Budapest : Central European University, 2020",90 p. ; 30 cm.,CEU Gender Studies Department master theses ; 2020/26,English,"This thesis aims to challenge the stereotypical collective image toward Romanian Roma women by offering a study case that examines the experiences of Romani women who live in a state of unintentional homelessness in Oslo, Norway and survive by begging, recycling bottles, or selling magazines. To tackle the hegemonic knowledge, which is predominantly toxified by negative prejudices toward Roma, the special narratives of Roma women refute these images and seek to disclose untold stories of resistance. As this is the first case study made on this topic by a Roma woman, I aim to create a space for the silenced voices of Romanian Roma women whose narratives and struggles remain unheard. In order to conduct a thorough investigation of the intersectional discrimination suffered by Roma women and the outcome of their oppression, I will use the framework of intersectionality and explore the concepts of resistance developed by Roma women. Thus, by taking the cases of Romani women who are left in extreme poverty in Romania and, therefore, “forced” to migrate as a strategy of survival to provide for them and their families, I will analyze both the intersectional experiences of Roma women and the forms of resistance they have developed as a way in resisting oppression.Hence, this study also aims to challenge the previous research made on Roma migration to Norway and Western countries by tackling the missing female experiences of Romani women in light of their multifaceted forms of discrimination that stem from being women, Roma, poor, migrants, and homeless.",Degree: MA,PDF,ETD,Unrestricted,System requirements: Adobe Acrobat Reader; PostScript compatible printer,,,MA,2,dumitru_maria.pdf 
Mathematics,PhD,http://tinyurl.com/cysrae, PhD (all years),63,https://sierra.ceu.edu/record=b1427973,http://www.etd.ceu.edu/2020/duyan_hulya.pdf ,"Zamora Luna, Oscar Alonso",Quantitative and extremal problems in graphs and hypergraphs / Oscar Zamora Luna,"Budapest : Central European University, 2020",84 p. ; 30 cm.,CEU Department of Mathematics PhD theses ; 2020/7,Mathematics,Degree: PhD,Probabilities,English,PDF file (749k),In this thesis we investigate several extremal problems in graphs and hypergraphs. In graphs we study generalized Turán Problems in simple graphs and in planar graphs. In hypergraphs we study Turán numbers of Berge Graphs and the Ramsey numbers of certain families.,ETD,Graph theory,,PhD,2,duyan_hulya.pdf 
Gender studies,MA,https://tinyurl.com/genderma2020,2020,26,https://sierra.ceu.edu/record=b1428475,http://www.etd.ceu.edu/2020/edwards_jennifer.pdf ,"Edwards, Jennifer Catherine","Queer(ing) community : queer community, spatiality, and temporality in Madison, WI / Jennifer Edwards","Budapest : Central European University, 2020",98 p. ; 30 cm.,CEU Gender Studies Department master theses ; 2020/10,English,"This thesis is a blended ethnographic analysis of the queer nightlife scene in Madison, Wisconsin USA, focused specifically on queer pop-up events. These events began in reaction to a homonormative and exclusionary permanent gay nightlife scene. I begin by providing background about Madison, its queer subculture, and the racial and class dynamics within the city. In the first chapter, I address the complications of defining queerness and community in both academic and organizing work, engaging in theoretical understandings of both terms, as well as incorporating the definitions and understandings of research participants. I use discourse analysis to parse the descriptions of several queer pop-up events in Madison and the political engagements of both permanent gay bars and Queer Pressure, a significant queer pop-up event series. In the second chapter, I begin with an analysis of the notion of the sacred within th scene, then move to engage with Jack Halberstam’s concepts of queer temporality and spatiality to consider the implications and possibilites of pop-up and queer takeover style events, in part by reflecting on sets, the spaces the parties take place in, and the transient nature of event series and Madison queers. In the third chapter, I take up the question of queer politics and intersectionality by reading Micheal Warner’s definition of queer politics alongside Lisa Duggan’s conception of the homonormative, and reflect on the resonances of intersectionality and crip theory within these frameworks. I then discuss the homonormative politics of the Madison LGBTQ+ community, and contrast them with an analysis of Queer Pressure’s political commitments. The final section of this chapter is a case study of the No Cops at Pride movement, reactions to and consequences of its engagement with radical queer politics, and a brief analysis of the resonance of this movement in 2018 with the racial justice mass movement of 2020. Ultimately, I do not strive to make any overarching conclusions with this thesis, but rather to take seriously and consider deeply a particular moment in time in the place that I consider home, and to gesture towards a more complex engagement with the queer spaces that exists in between the rural and the urban in the United States.",Degree: MA,PDF,ETD,Unrestricted,System requirements: Adobe Acrobat Reader; PostScript compatible printer,,,MA,2,edwards_jennifer.pdf 
Legal studies,MA,https://tinyurl.com/legalma2020,2020,78,https://sierra.ceu.edu/record=b1429003,http://www.etd.ceu.edu/2020/elbasuoney_ahmed.pdf ,"Elbasuoney, Ahmed",Constitutional courts in transition / Ahmed Elbasuoney,"Budapest : Central European University, 2020",32 p. ; 30 cm.,CEU Legal Studies Department master theses ; 2020/20,English,"The thesis examines the constitutional reforms to judicial review institutions in Egypt, Morocco and Tunisia in the waka of the Arab Spring",Degree: MA,PDF file (515k),ETD,Unrestricted,System requirements: Adobe Acrobat Reader; PostScript compatible printer,,,MA,2,elbasuoney_ahmed.pdf 
Economics,MA,https://tinyurl.com/ecoma2018,2018,52,https://sierra.ceu.edu/record=b1399963,http://www.etd.ceu.edu/2018/fleck_david-marton.pdf ,"Fleck, Dávid Márton",Estimating demand and market power in two-sided markets : case of Hungarian newspaper industry / Dávid Márton Fleck,"Budapest : Central European University, 2018",40 p. ; 30 cm.,CEU Economics Department master theses ; 2018/15,English,"I propose a model for estimating demand in two-sided markets where two groups of agents interact through an intermediary platform. The model takes into account the cross-group network effects between the two sides. Based on the estimated demand parameters, platforms’ markup on both sides can be recovered, making it possible to measure market power in two-sided markets. One of the most typical examples for two-sided markets is the newspaper industry, where advertisers and readers interact through newspapers. Using two-stage least squares fixed effect estimation in Hungarian daily newspaper market between 2008 and 2016, I find that readers value advertising, their demand elasticities, however, are relatively low with respect to advertising content as well as to cover price. Estimating advertising side did not provide meaningful results, suggesting that distortions are likely to be present in the Hungarian newspaper advertising market.",Degree: MA,PDF file (1181k),ETD,Unrestricted,System requirements: Adobe Acrobat Reader; PostScript compatible printer,,,MA,2,fleck_david-marton.pdf 
Philosophy,PhD,http://tinyurl.com/yhque8b, PhD (all years),45,https://sierra.ceu.edu/record=b1164782,http://www.etd.ceu.edu/2013/fphtug01.pdf ,"Turturea, George Romeo",Can interdependent reasoning help provide a solution to the problem of political obligation? / George Romeo Turturea,"Budapest : Central European University, 2013",217 p. ; 30 cm.,CEU Philosophy Department PhD theses ; 2013/1,English,"My purpose is to provide an answer to the question whether interdependent reasons for action can help provide a solution to the problem of political obligation. I propose an investigation which unfolds in two parts. In the first part, I examine the relationships that hold between personal autonomy, political authority and rationality, focusing on a reading of these relationships according to which, even though autonomous individuals may not a have reason to comply with the directives of political authority as long as they consider the matter from the standpoint of individual rationality, they may nevertheless have a reason to comply with such directives if they consider the matter from the standpoint of collective rationality. I explore the strengths and limitations of a model that tries to provide the normative foundations of political obligation by employing the principle of collective rationality, and conclude that, while the principle of collective rationality plainly dictates a greater level of compliance with the law than the principle of individual rationality taken in conjunction with an individual’s moral values would dictate, the same considerations which are invoked to establish the need to appeal to a principle that would give one a reason to obey the law over and above what substantive moral principles working within the framework of individual rationality give one reason to do might render implausible any attempt to account for political obligation by reference to such substantive moral principles. To deal with this difficulty, I introduce a particular conventionalist account, hoping to take a step in the direction of rehabilitating the idea that the reasons for obeying the law can be accounted for by appeal to substantive moral considerations.  In the second part, I scrutinize the main arguments used within the conventionalist framework that I focus on in order to back up the claim that political obligation, if it exists, can only be accounted for in terms of interdependent reasons for action. I look at the idea that a promising strategy in dealing with the problem of political obligation is to show that the treatment of ordinary coordination problems can be extended to other game theoretic situations, such as the prisoner’s dilemma. I find that the conventionalist account is able to answer the objection that any conventionalist account of authority and political obligation is misguided because the conventionalist analysis cannot properly be applied to situations of significant conflict of interests. I also argue that, in order to defend the conventionalist view according to which political obligation is to be justified by reference to a pattern of mutual expectations, one should make crucial use of the idea of cooperative dispositions. To this end, I show that conventionalists are right in claiming that assumptions about cooperative dispositions are not ad hoc, and, hence, that conventionalism can make sense of the idea that patterns of mutual expectations are not immune to moral criticism.",Degree: PhD,PDF file (1326k),ETD,Unrestricted,,Political obligation,,PhD,2,fphtug01.pdf 
Philosophy,PhD,http://tinyurl.com/yhque8b, PhD (all years),45,https://sierra.ceu.edu/record=b1161020,http://www.etd.ceu.edu/2012/fphwaz01.pdf ,"Wagner, Zoltan","Reflectivity, caring and agency  / Zoltan Wagner","Budapest : Central European University, 2012",173 p. ; 30 cm.,CEU Philosophy Department PhD theses ; 2012/1,Agent (Philosophy),English,"As a solution for the problem of free will and determinism, Harry G. Frankfurt developed his hierarchical theory of desires. This controversial theory led to fruitful debates not only in connection with the problem of free will but in other areas as well including personal and practical identity, rationality in action and the problem of agency in general. Thus, this dissertation is not focused on the problem of free will but on the role of second-order desires in agency. More particularly, it discusses the importance of two features of human agency that Frankfurt emphasized most. First, humans are reflective, that is, they can evaluate their own desires. Second, humans are capable of caring about things, that is, some things are important for them in a special way. Frankfurt understands both of these crucial abilities as based on our ability to have second-order desires. In agreement with Frankfurt, I will argue that both reflectivity and caring are very important and basic abilities, and that they are connected to each other. However, I will disagree about their relation and about the definition of caring as dependent on second-order desires. I will argue that caring in the most basic sense is not a reflective ability but a first-order evaluation which is centrally important to action. I will also try to show that the reason humans have second-order desires is that they care about things. Thus, our second-order desires should be based on our personal values; in other words, what we care about. As a consequence, the most important claim of this dissertation is the following: though humans are reflective creatures, it is not reflectivity that is the most important feature of human life. Rather, caring, as a first-order evaluation is more important and our ability to reflect about our motivation depends on being able to care about things in this sense. At the end of the dissertation I will briefly discuss a serious problem for any caring based theory of action: the problem of self-control and self-management. Since we do not directly control by decisions what we care about, it seems that we cannot have these abilities. However, I will try to sketch a method of self-control and self-management which is consistent with the importance of the redefined concept of caring and which is based on self-trust and openness. This method will add one more argument against the importance of reflectivity: second-order desires do not help us in managing our desires; rather, they can interfere with self-control and become self-defeating strategies.",Degree: PhD,PDF file (694k),ETD,,Free will and determinism,,PhD,2,fphwaz01.pdf 
Sociology,MSc,https://tinyurl.com/socma2018,2018,22,https://sierra.ceu.edu/record=b1399188,http://www.etd.ceu.edu/2018/gajic_jelena.pdf ,"Gajic, Jelena",The street magazine LiceUlice : a safety net and a platform for social activism in Serbia / Jelena Gajic,"Budapest : Central European University, 2018",64 p. ; 30 cm.,CEU Sociology Department master theses ; 2018/14,English,"This research aims to examine the role of the street magazine LiceUlice, both as a platform for social activism and as a safety net for marginalised groups. These two issues are explored via the discourse analysis of the magazine, and via unstructured interviews with the magazine employees and vendors. By examining the magazineâ€™s writings, this research illuminates their notions of poverty, homelessness, social inclusion, the role of the state and other safety net institutions. It sheds a new light on how the magazine is used as a platform for opening the questions on discrimination, poverty and mental health issues not discussed in the mainstream media. As such, the magazine serves as a tool for subversive social activism. However, this research also shows that despite the often radical rhetoric, the magazine still implies neoliberal work ethic on its vendors. The interviews with the magazine employees uncover troubling situation with the state institutions and the collapse of the safety net, and the attempts that the magazine is doing to offer support to its vendors. Such support often goes beyond a basic selling training, taking the role of the missing state institutions particularly regarding various trainings for job search and mental health support. Finally, the interviews with the vendors question the market model imposed on them, and ideas of sale efficiency as a mean to improve their social condition during the post-socialist transformation. I argue that the magazine LiceUlice is a valuable platform for both, social activism and support of its vendors, but it also reveals the extent of the neoliberal devastation of the state social institutions, overwhelming poverty and social stratification, and insecurity and risk that marginalised groups face daily in Serbia.",Degree: MA,PDF file (545k),ETD,Unrestricted,System requirements: Adobe Acrobat Reader; PostScript compatible printer,,,MA,2,gajic_jelena.pdf 
Legal studies,MA,https://tinyurl.com/legalma2020,2020,78,https://sierra.ceu.edu/record=b1429009,http://www.etd.ceu.edu/2020/gashaw_temelso.pdf ,"Gashaw Getahun, Temelso",Countering online hate speech through legislative measure : the Ethiopian approach in a comparative perspective / Temelso Gashaw Getahun,"Budapest : Central European University, 2020",57 p. ; 30 cm.,CEU Legal Studies Department master theses ; 2020/26,English,"It is almost self-evident that the phenomenon of online hate speech is on the rise. Meanwhile, governments around the world are resorting to legislative measures to tackle this pernicious social problem. This Capstone thesis has sought to offer an overview of these legislative responses to online hate speech in four different jurisdictions and unravel their implication on the right to freedom of expression. Using a comparative methodology, the research describes how the regulation of social networking platforms in relation to hate speech is being approached by the Council of Europe, German, the United States of America and Federal Democratic Republic of Ethiopia. It tests the hypothesis that legal frameworks for moderation of user-generated online content can have a more detrimental effect for freedom of speech in semi-democratic countries like Ethiopia than in developed liberal democracies. Findings of this project regarding the recently enacted Ethiopian Hate Speech and Disinformation Prevention proclamation will offer some guidance for The Council of Ministers in the course of adopting implementing regulation.",Degree: MA,PDF file (776k),ETD,Unrestricted,System requirements: Adobe Acrobat Reader; PostScript compatible printer,,,MA,2,gashaw_temelso.pdf 
Philosophy,PhD,http://tinyurl.com/yhque8b, PhD (all years),45,https://sierra.ceu.edu/record=b1245537,http://www.etd.ceu.edu/2017/hangai_attila.pdf ,"Hangai, Attila",Alexander of Aphrodisias on phantasia : An Aristotelian account of mental representation in 2nd-3rd centuries CE  / Attila Hangai,"Budapest : Central European University, 2017",202 p. ; 30 cm.,CEU Philosophy Department PhD theses ; 2017/2,"Philosophy, Ancient",Representation (Philosophy),Philosophy of mind,English,"I discuss the account of phantasia of Alexander of Aphrodisias, a most prominent Late-Antique Aristotelian. For Aristotle phantasia is a motion of the perceptive soul that makes possible a great amount of activities and higher cognitions beyond sense-perception. Phantasia became a fundamental psychological concept in the Hellenistic Era: in empiricist epistemology, in action theory as perceptual representation of the external world; in aesthetics as creative imagination. I argue that Alexander proceeds from an Aristotelian framework of parts and capacities of the soul, but unlike Aristotle, he distinguishes a distinct capacity for phantasia. The main reason for this comes from his polemic against the Stoics: they do not acknowledge an activity of phantasia. A distinct activity requires a distinct object, which in turn a distinct capacity. The distinct status of a phantasia-capacity in itself modifies the architecture of the soul in comparison with Aristotle. But in addition Alexander makes important changes in the framework: he makes capacities as basic (and rather modular), and parts and the soul as sets of capacities. The object of phantasia is the residue from perception in activity. The status of this as internal object needs clarification. I show that it is internal on account of being a physical process in the body. Again, I argue that it is the causal object of phantasia: it is the item that provides content to the phantasia-activity by triggering it. But the residue is not an intentional object: it is a representation of something else. I give a reconstruction of Alexander`s account how the residue may be representation. Accordingly, it is a representation in virtue of preserving fully a perceptual content (something that had been perceived); or in virtue of functioning as an equivalent of a fully preserved residue insofar as phantasia completed an incompletely preserved residue. The latter case explains a wide range of cases, in general the fact that phantasia is more prone to error than perception. Finally I analyse the activity of phantasia. I argue that its content is propositional, in particular it is ‘S is P’: a predication of a perceptible feature P of a thing that caused a perception S. First, I show that it is implausible to construe simple cases of phantasia (or perception: for perception has the same type of content as phantasia) as non-propositional, demonstrating that the object reading of the content (x sees ‘white’) is inadequate in that at the best it reduces to existential propositions (‘there is white’). Again, I analyse two positive evidences. (1) Alexander`s account of the truth-conditions of phantasia implies propositional content: phantasia is about an existent thing, S; and it is such as the thing, P. (2) The account of simultaneous perception (of several perceptibles) entails propositional content, and even uses examples as ‘this is white’. The phantasia-activity is said to be krisis, which I take to be judgement: primarily because its content is propositional. I argue that it is a certain type of judgement, perceptual, in contrast to conceptual judgements of the rational soul-part: esp. opinion. However, phantasia-judgement may be distinguished from perceptual judgement only because they are concerned with different objects: internal vs. external.",Degree: PhD,,Aristotle,,PhD,2,hangai_attila.pdf 
