department,program,lib_link,year,thesis_in_that_year,thesis_link,pdf_link,author,title,published,description,series,language,summary,note,filetype,localnote,access,systemdet,subject,alttitle,program_sampling,flag,coder
Gender studies,MA,https://tinyurl.com/genderma2018,2018,29,https://sierra.ceu.edu/record=b1400344,http://www.etd.ceu.edu/2018/vukosavljevic_jovana.pdf ,"Vukosavljevic, Jovana",Whose sex? : public opinion on sexual education initiative in Serbia / Jovana Vukosavljevic,"Budapest : Central European University, 2018",87 p. ; 30 cm.,CEU Gender Studies Department master theses ; 2018/23,English,"The sex education initiative was introduced in 2013 by the Serbian Provincial Secretariat for Sports and Youth as an elective course in Serbian high schools. This type of project has not yet been recorded in Serbian education, therefore it received an enormous amount of attention. In this thesis, I look at the discourses of sex education in contemporary Serbia, through a content analysis of media texts, political statements and social media, as well as by analyzing interviews conducted with parents in the capital of Serbia, Belgrade during April 2015. In my thesis I argue that the narratives around sexual education reflect the nationalist ideas, as well the ongoing debate on “Europeanization” in Serbia. By presenting the role of women's body in the nationalist rhetoric, I examine the topics on women, reproduction and nation through the analysis of perceptions of sex education in Serbia. Later on I present how the narratives of sex education reflect the idea of East/West, tradition/modernity in Serbia. My case study contributes to existing scholarship on gender and nationalism in Serbian context, adding sex education as an angle for the analysis.",Degree: MA,PDF,ETD,Unrestricted,System requirements: Adobe Acrobat Reader; PostScript compatible printer,,,MA,0,1
School of public policy,MA,https://tinyurl.com/sppma2018,2018,41,https://sierra.ceu.edu/record=b1401713,http://www.etd.ceu.edu/2018/adhikari_anshu.pdf ,"Adhikari, Anshu",Nepalese low-skilled migrants in Portugal : skill perception and skill gaining strategies / Anshu Adhikari,"Budapest : Central European University, 2018",57 p. ; 30 cm.,CEU School of Public Policy master theses ; 2018/4,English,"The aim of the research is to understand skill development avenues adapted by low- skilled Nepalese migrants in Portugal. With a sudden and huge inflow of low-skilled immigrants in the EU since the European migration crisis, it is necessary to understand how Portugal has adopted policies on skill development to build low-skilled immigrants' competencies in the European job market. With the changes in policies of immigration and skill development, it has also become important to analyze migrants' perception of skills and their strategies of adapting further skills to be employed on high-skill jobs. The purpose of the dissertation is about investigating the integration of migrants into EU labor markets. It also explores labor migration from South Asia to continental Europe in order to find gapes in European labor migration policies, and strategies used by low- skilled labors coming from South Asia. Particular emphasis is given to the case of Nepalese low-skilled migrants in exploring migrants' understanding of their skills, their strategy in attaining available skill gaining opportunity and their decision on transnational mobility after their stay in Portugal. The dissertation is structured to show the research aim, objective and methodology. The dissertation introduces Portugal and the extent of low-skilled migrants working in the Portuguese labor market. Following the literature of skill measurement and skill mismatch, the paper highlights the limited proxies used for skill measurement. With in-depth interviews with low-skilled Nepalese migrants, the research shows how migrants perceive their skills in the foreign land irrespective of their educational attainments. Finally, the analysis derived from the interviews questions the existing integration programmes and its effectiveness.",Degree: MA,PDF file (2223k),ETD,Unrestricted,System requirements: Adobe Acrobat Reader; PostScript compatible printer,,,MA,0,1
School of public policy,MA,https://tinyurl.com/sppma2018,2018,41,https://sierra.ceu.edu/record=b1401863,http://www.etd.ceu.edu/2018/murphy_therese.pdf ,"Murphy, Therese Joan",Predictive policing and the carceral state : a comparative case analysis of Palantir in New Orleans and the strategic subject list in Chicago / Therese Joan Murphy,"Budapest : Central European University, 2018",48 p. ; 30 cm.,CEU School of Public Policy master theses ; 2018/28,English,"Police departments across the United States use predictive policing—algorithm-based analytical tools aimed at forecasting crime—to maximize scarce resources and prevent crime. However, these programs raise significant legal and ethical concerns, including lack of privacy, transparency, accountability, and oversight. Using the case studies of Palantir in New Orleans and the Strategic Subjects List in Chicago, this thesis identifies the emergence of a new byproduct of predictive policing: the surveillance city. It examines the morality and legality of this new development, analyzing two notable issues—racial bias and the democratic deficit. It subsequently provides recommendations on how to mitigate the effects of the surveillance city through sustained public engagement through a coalition-based civil rights movement for the digital age. It also seeks to explain some of the developments in predictive policing and the impediments to further reform using a carceral state framework, which has not previously been done in the academic literature.",Degree: MA,PDF file (1079k),ETD,Unrestricted,System requirements: Adobe Acrobat Reader; PostScript compatible printer,,,MA,0,1
School of public policy,MA,https://tinyurl.com/sppma2018,2018,41,https://sierra.ceu.edu/record=b1401880,http://www.etd.ceu.edu/2018/trlifaj_simon.pdf ,"Trlifaj, Simon","How knowledge becomes a public good : permanency, patents and secrecy / Simon Trlifaj","Budapest : Central European University, 2018",64 p. ; 30 cm.,CEU School of Public Policy master theses ; 2018/40,English,"Knowledge is often considered to be a public good, and many policy proposals take lessons from public goods management and apply them to knowledge creation. I argue that this is an oversimplification. Knowledge can be partially rival and excludable, and companies routinely use secrecy to mitigate the risk of knowledge disclosure. The path of an invention from an inventor to general knowledge is far from straightforward, influenced by many factors including institutional interventions such as patents. I introduce a new property of permanency—the inability to reverse transactions with a good—to analyze how knowledge becomes a public good. To show the effects of permanency empirically, I use assignment data on over four million US patents to test the hypothesis that patents on relatively less reverse-engineerable inventions will more likely be reassigned sooner after the application date. The results of a logistic and survival regression support this hypothesis, which suggests that permanency plays a role in motivations of inventors and companies to patent. Future research on knowledge creation and disclosure and policy proposals for patent reforms thus should employ a more nuanced conceptualization of knowledge, in which permanency plays a role.",Degree: MA,PDF file (1563k),ETD,Unrestricted,System requirements: Adobe Acrobat Reader; PostScript compatible printer,,,MA,0,1
Environmental sciences,MSc,https://tinyurl.com/envma2018,2018,22,https://sierra.ceu.edu/record=b1401939,http://www.etd.ceu.edu/2018/jawaid_eqra.pdf ,"Jawaid, Eqra","The growth of solar off-grid energy technology : a case study of Dharnai solar village in Bihar, India / Eqra Jawaid","Budapest : Central European University, 2018",67 p. ; 30 cm.,CEU Department of Environmental Sciences & Policy master theses ; 2018/12,English,"Despite the efforts of rural electrification from both central and state governments, Bihar is the least electrified state in the country. It is found in the literature that decentralized solutions such as renewable off-grid systems can be a viable and more efficient option for rural electrification. Recently, a smart solar off-grid system has been developed in Dharnai village in Bihar with the assistance of Greenpeace India. The aim of the thesis was to investigate and identify drivers and barriers to the growth of the solar off-grid system in Dharnai, fill the knowledge gap about the solar off-grid sector, and provide recommendations to improve the sector in the state. Data collected from interviews and focus group discussion in Dharnai was analyzed using Painuly’s (2001) framework. The findings suggested that significant drivers are unmet demands of consumers, policy ambitions, consumer’s capacity and willingness to pay, benefits of solar perceived by consumers, an indicator of development, and uncertainty about the grid connection. Furthermore, significant barriers to the growth of solar off-grid systems are policy loopholes, unmet demands of consumers, consumer’s affordability, and lack of financing options. The thesis recommends that the Bihar government should start awareness campaigns to improve consumer’s lack of awareness about the benefits of solar off-grid systems; make grid expansion predictable so that consumers have clarity about its timeline; take appropriate measures to improve financing and overall affordability of the consumers.",Degree: MSc,PDF file (1571k),ETD,Unrestricted,System requirements: Adobe Acrobat Reader; PostScript compatible printer,,,MA,0,1
Legal studies,MA,https://tinyurl.com/legalma2018,2018,60,https://sierra.ceu.edu/record=b1405852,http://www.etd.ceu.edu/2019/taba_szabolcs.pdf ,"Taba, Szabolcs Sándor",Protection orders as tools of defending women victims of domestic violence in light of the European standards : Austria and Hungary / Szabolcs Sándor Taba,"Budapest : Central European University, 2018",133 p. ; 30 cm.,CEU Legal Studies Department master theses ; 2018/51,English,"The thesis aims at presenting the role of protection orders as tools of defending victims of domestic violence against women. It assesses the development and the significance of these measures in the context of states’ due diligence obligation. It provides an analysis of the relevant case law of the European Court of Human Rights and the Court of Justice of the European Union, and defines the cornerstones of the protection level to be provided by the state. It presents and compares the rules in force in Austria and in Hungary and identifies their weaknesses. It argues that the objective of the protection orders of providing prompt assistance for victims is undoubted. However, as can be seen in practice, the legal provisions and their realization is often incomprehensibly far from the intended goals as if the legislator had not understood the essence of the issue. Without improvement, some of the rules are nothing more than just providing the opportunity for the state of claiming the completion of one of its international obligations. In order for the protection orders effectively to fulfil their mission, states, officials of law enforcement authorities and even ordinary citizens must realize the deep-rooted nature of violence against women. Therefore, not only the rules and the practice of the authorities should be improved, but people’s mindset also has to be altered for attaining the objectives pursued. This positive change should be facilitated by the state itself which would presumably have repercussions on the legislator’s approach.",Degree: MA,PDF file (1782k),ETD,Unrestricted,System requirements: Adobe Acrobat Reader; PostScript compatible printer,,,MA,0,1
Economics,Business,https://tinyurl.com/ecobus2018,2018,26,https://sierra.ceu.edu/record=b1410988,http://www.etd.ceu.edu/2018/elhence_geeta.pdf ,"Elhence, Geeta",Predict customer purchase behavior : product return rate / Geeta Elhence,"Budapest : Central European University, 2018",11 p. ; 30 cm.,CEU Economics and Business Department master theses ; 2018/7,English,"The main objective of this project was to implement Machine Learning power, in order to predict the customer return rate for an American ecommerce which sells office supplies, furniture and electronic equipment online. The E commerce",Degree: MSc,PDF file (664k),ETD,Capstone  project,Unrestricted,.,,Business,0,1
Economics,Business,https://tinyurl.com/ecobus2018,2018,26,https://sierra.ceu.edu/record=b1410996,http://www.etd.ceu.edu/2018/tsubakiyama_sho.pdf ,"Tsubakiyama, Sho Samuel",Learning by experience : building a decision tree to QC and resolve data issues / Sho Samuel Tsubakiyama,"Budapest : Central European University, 2018",10 p. ; 30 cm.,CEU Economics and Business Department master theses ; 2018/13,English,"This thesis tracks a project that I conducted at an asset management firm where I developed an automated decision tree that quality controls data and resolves issues. The decision tree utilises SQL, UNIX, and C-based programming. Besides a technical documentation, this paper documents the challenges and successes of this project from a management perspective.",Degree: MSc,PDF file (131k),ETD,Capstone  project,Unrestricted,.,,Business,0,1
Economics,Business,https://tinyurl.com/ecobus2018,2018,26,https://sierra.ceu.edu/record=b1411249,http://www.etd.ceu.edu/2018/kattika_lalith.pdf ,"Kattika, Lalith Kumar",Financial planning & valuation of a new venture : Oriana Hungary / Lalith Kumar Kattika,"Budapest : Central European University, 2018",12 p. ; 30 cm,CEU Economics and Business Department master theses ; 2018/19,English,The financial planning and valuation of a new sub-division of Oriana for presenting to the investors. The key deliverables for the project were analyzing the current financial plan and company valuation of the new venture before advancing to the investors.,Degree: MSc,PDF file (318k),ETD,Capstone  project,Unrestricted,.,,Business,0,1
School of public policy,MA,https://tinyurl.com/sppma2019,2019,30,https://sierra.ceu.edu/record=b1415548,http://www.etd.ceu.edu/2019/goodrich_ian.pdf ,"Goodrich, Ian Edward",Mapping the laundromat : a network analysis of money laundering in the United Kingdom / Ian Edward Goodrich,"Budapest : Central European University, 2019",79 p. ; 30 cm.,CEU School of Public Policy master theses ; 2019/2,English,"Money laundering enables crime, saps public resources, and undermines the state in rich and poor countries alike. Investigations into money laundering, once traditionally the domain of government, financial institutions and international bodies, are increasingly being undertaken by journalists, NGOs and academics. Using the case study of the United Kingdom, this study explores the use of network analysis for the study money laundering using open data. Using a custom-built Python module, this study analyses money laundering risk in over 2,000 corporate networks and 130,000 companies from the UK Companies House registry. At the company level, it finds that high risk companies may be younger and more likely to use the Limited Liability Partnership structure. At a network level, it provides tentative evidence that companies used for money laundering may cluster with other such companies, and that network size and triangular graph structures may have potential for use in risk prediction using open data.",Degree: MA,PDF file (3342k),ETD,Unrestricted,System requirements: Adobe Acrobat Reader; PostScript compatible printer,,,MA,0,1
Sociology,MSc,https://tinyurl.com/socma2019,2019,27,https://sierra.ceu.edu/record=b1419976,http://www.etd.ceu.edu/2019/udvari_orsolya.pdf ,"Udvari, Orsolya",Ways of seeing the other migration in contemporary Hungarian cinema / Orsolya Udvari,"Budapest : Central European University, 2019",48 p. ; 30 cm.,CEU Sociology Department master theses ; 2019/22,English,"Around 2015, the migration wave had a huge impact in Hungary. The crisis had resulted in the intensification of the migration discourse that was never seen before in the country. A part of this intensification was a strong state campaign that has been built on the crisis: a nationalist and hegemonic rhetoric which was rejective and hostile towards migrants, asylum seekers and refugees. This propaganda spoke about migratory processes in the framework of securitization where the process was understood and mobilized as a threat to the European-Christian culture. This narrative was not only rhetorically but visually outstanding. State financed posters and advertisements represented “the migrant” as a voiceless, faceless, male, violent, dark-skinned person who is not even an individual but exists in a horde-like group of people. Besides of this xenophobic and hostile context, counter-hegemonic narratives emerged not just in the form of social movements but, as I argue, in the artistic-visual field too. In my thesis, I focus on this contemporary counter-discourse of the Hungarian cinema through the lenses of three movies which have a privileged position in the “migration movie” corpus in Hungary, not only because all of them was funded by the state but because they earned nationwide recognition. These movies are The Citizen (2016), Jupiter’s Moon (2017) and Easy Lessons (2018). The first part of my research would like to contextualize these movies with special regard to their socio-political and cultural context. For this, I carry out discourse analysis on the already existing literature. After, I make the analysis of the movies themselves to explore the place of them in the discourse on visual representation and migration after 2015. The main questions of the analysis are how these movies are the part of the counter-discourse, what are those circumstances by the dominant state discourse that could challenge free artistic expression, and in which ways aesthetic and political elements are intertwined in the visual language of these movies. The research would like to answer these questions through the politics of (in)visibility and those artistic instruments that aim to transform the unseen “Other” into visible. Therefore the thesis displays two competing visual attitudes towards the representation of migration: one by the neo-authoritarian state propaganda and another by the contemporary Hungarian cinema.",Degree: MA,PDF file (430k),ETD,Unrestricted,System requirements: Adobe Acrobat Reader; PostScript compatible printer,,,MA,0,1
Legal studies,MA,https://tinyurl.com/legalma2019,2019,50,https://sierra.ceu.edu/record=b1420065,http://www.etd.ceu.edu/2019/petrovic_danica.pdf ,"Petrovic, Danica",Regulation and the case law on business format franchise in the United States and Europe : lessons for Serbia / Danica Petrovic,"Budapest : Central European University, 2019",56 p. ; 30 cm.,CEU Legal Studies Department master theses ; 2019/22,English,"This paper focuses on comparative analysis of business format franchise in the United States and Europe, with a special focus on Serbia. Franchise is widely recognized as a modern, yet new and complex model of doing business, making it an exceptionally interesting topic to analyze. The selection of jurisdictions is made with respect to the rich experience on franchise that comes from United States, the birthplace of business format franchise, that had been followed by Europe. Notably, business format franchise is treated differently in these two continents and that is why an analytical comparison sheds the light over the reasons for regulating, as well positive and negative features of various regulatory regimes. Serbia, on the other hand, is the central subject of this thesis. Franchise in Serbia is treated as an innominate contract, with no particular regulation and developed practice. However, the novelty in Serbia is the Draft of Civil Code that is not yet enacted, but regulates franchise for the first time. Therefore, the ultimate goal is to analyze the Draft and evaluate it by comparison with other regulatory systems.",Degree: MA,PDF file (755k),ETD,Unrestricted,System requirements: Adobe Acrobat Reader; PostScript compatible printer,,,MA,0,1
Sociology,MSc,https://tinyurl.com/socma2019,2019,27,https://sierra.ceu.edu/record=b1420120,http://www.etd.ceu.edu/2019/qiu_zhitian.pdf ,"Qiu, Zhitian",Factory regime of duty contractor under platform capitalism : an example of Chinese logistics industry / Zhitian Qiu,"Budapest : Central European University, 2019",52 p. ; 30 cm.,CEU Sociology Department master theses ; 2019/26,English,"In this thesis, by doing ethnographic fieldwork at two courier stations, I put forward a concept of factory regime of duty contractor to better understand the production politics of informality in the third-party logistics companies under the demand of the booming platform economy. As pointed out by Burawoy(1985), the factory regime should be examined with regards to four factors: labour process, reproduction of labour power, market competitions among firms and the state intervention. Within the framework composed of these four dimension, I examine the production politics in the courier sector and conclude that: first, as a result of the fierce market competition, intention to lower the labour cost and the characteristics of the work itself, the courier worker is organized by the capital both as an employee and a contractor, which indicated the tension of lose labour control and intensified labour control ; secondly, the first point may contribute to the discussion of the separation of execution and conception work in an informal work sector; thirdly, such a concept indicates a self-motivated and self-responsible ideology; fourthly, the state’s public governance may have a direct impact on the worker’s condition, so as to the factory regime. The state intervention of an authoritarian regime, in the case of courier sector, maybe the key factor to trigger the collective resistance of the workers.",Degree: MA,PDF file (365k),ETD,Unrestricted,System requirements: Adobe Acrobat Reader; PostScript compatible printer,,,MA,0,1
Gender studies,MA,https://tinyurl.com/genderma2019,2019,35,https://sierra.ceu.edu/record=b1420525,http://www.etd.ceu.edu/2019/baqais_david.pdf ,"Baqais, Dávid",The affective potential of queer shame on screen / Dávid Baqais,"Budapest : Central European University, 2019",80 p. ; 30 cm.,CEU Gender Studies Department master theses ; 2019/5,English,"This thesis explores the potential of shame as intersubjective affect through three filmic representations of queer shyness in widely divergent cinematic texts: Tom Ford’s high-profile US film adaptation of Christopher Isherwood’s novel A Single Man (chapter 1); Alain Guiraudie’s French erotic thriller L’Inconnu du lac, an art house exploration of queer desire, sex and death (chapter 2); and a Brazilian short film directed by Daniel Ribeiro, entitled Eu Nau Quero Voltar Sozinho, an coming-of-age narrative of a blind teenage boy (chapter 3). These ideas are rehearsed against the theoretical backdrop of Leo Bersani’s and Lee Edelman’s antirelational queer theory, José Estaban Muñoz’s work on queer potentiality, relationality and hope as articulated in Cruising Utopia in opposition to antiutopian antirelationality, and Eve Kosofsky Sedgwick’s affective turn (in particular her theorizing on shame and her concept of paranoid and reparative reading). The analyses in the first two chapters gesture toward a displacement of antirelational queer theory’s overinvestment in the radicality of strategically embracing cultural fantasies of male homosexuality as psychic negativity or erotic self-annihiliation. In contrast to these tropes, a vision of queer relationality grounded in the relational dynamics of shame is forwarded, drawing on Sedgwick’s work on shame inspired by Silvan Tomkins’s affect theory. The shy queer man thus comes to figure as a counterpoint to the death-driven queer subject enraptured by jouissance. The third chapter, in turn, moves from such a contrastive “anti-antirelational” engagement to a closer exploration of Tomkins’s theory of shame, combining it with phenomenological film theory and Sara Ahmed’s work on queer phenomenology, arguing that the short film’s climactic moment allows us to think shame as utopian potentiality as conceived by Muñoz. Finally, the conclusion suggests a conception of shame as reparative affect in contrast to routinized habits of thought in paranoid antirelational queer theory.",Degree: MA,PDF,ETD,Unrestricted,System requirements: Adobe Acrobat Reader; PostScript compatible printer,,,MA,0,1
