department,program,lib_link,year,thesis_in_that_year,thesis_link,pdf_link,author,title,published,description,series,language,summary,note,filetype,localnote,access,systemdet,subject,alttitle,program_sampling,coder,folder_name
Philosophy,PhD,http://tinyurl.com/yhque8b, PhD (all years),45,https://sierra.ceu.edu/record=b1189216,http://www.etd.ceu.edu/2016/somodi_gergo.pdf ,"Somodi, Gergo",A perlocutionary account of metaphors / Gergo Somodi,"Budapest : Central European University, 2015",151 p. ; 30 cm.,CEU Philosophy Department PhD theses ; 2016/1,Analysis (Philosophy),English,"Much has been said about metaphors in philosophy of language, but few such thought provoking and controversial papers had been written on how they “work their wonders” than Donald Davidson’s What Metaphors Mean (1978). In the last four decades many linguist, philosopher and cognitive scientist, working on an account of how we communicate by means of metaphors, started with pointing out what Davidson got wrong or right. His view that metaphor carries no special meaning or content different form the literal meaning of the expressions it is comprised of, that it is simply a tool to draw our attention to similarities, served as the starting point for many to articulate their own theory (cf. Bergmann, 1982; Rorty and Hesse, 1987; Moran, 1989; Hills, 1997; Stern, 2000; Camp, 2003; Guttenplan, 2005; Reimer and Camp, 2006; Camp, 2008; Stern, 2008; Reimer, 2008; Lepore and Stone, 2010). is thesis is no different. I think what Davidson essentially got right is emphasizing the causal effects of metaphors, i.e., that metaphors nudge us into noting similarities, to take on a new perspective on the mentioned things. He also thought—to anticipate, this will be where I disagree—that this is the ulterior aim of metaphor and the metaphorical speaker. Consequently, according to Davidson, there is no special meaning the speaker aims to convey, given that this effect can be achieved by the literal meaning of the uttered sentence, or its comprehension thereof. is is not to deny that the metaphor has a point iv or that it inspires a lot of thoughts. In his Communication and Convention, Davidson (1984, 273) links what he calls ulterior purposes of utterances to John L. Austin’s notion of perlocution (Austin, 1962); acts people perform by uttering sentences. Such an act for instance is, making the audience to undertake certain actions by asking them to do so, or to surprise them by what one is saying. Given this much, Davidson (1978) can be described as developing a perlocutionary theory of metaphor (cf. Lepore and Stone, 2010). My aim is to show that a perlocutionary theory does not have to follow Davidson’s arguments and conclusions, just roughly outlined above. After a careful examiniation of the notion of metaphorical meaning, the perspectival effect of metaphors, and the notion of perlocution and perlocutionary effects, I will argue, first, that metaphors’s effect of making us see something in a new light is indeed a perlocutionary effect. I call this the Perlocution Claim. Second, I will also point out that achieving perlocutionary effects are not necessarily the ulterior purposes of the speakers. In most cases, they are just one among the many intended effects a speaker can have in uttering something. Consequently, Davidson’s claims about the casual effects of metaphors will not support his conclusion that there is no metaphorical meaning beyond the perspectival effect of metaphors, in as much as there are examples where eliciting the metaphorical effect is not the final aim of the speaker. Examples are not hard to find, and they support the existence of metaphorical meaning contrary to Davidson. Nevertheless, recent theories of metaphorical meaning do not fit well with the Perlocution Claim. Partly, because they reject the claim as belonging to Davidsonian non-cognitivsm (cf. Stern, 2000), a label introduced to designate theories denying the existence of metaphorical meaning. Additionally, because they also consider perlocutionary effects to be final, non-linguistic, aims of utterances. e proposed theory of metaphor endorsing the Perlocution Claim relies on the v distinction between different possible realizations of perlocutionary effects. It incorporates a non-cognitivist theory for some examples of metaphors while at the same time, using the same theoretical framework, it provides an account of how metaphorical utterances have a special meaning on certain occasions. As a theory of metaphorical meaning, it is close to that developed by Elisabeth Camp (2003; 2008; 2014) on which if there is a metaphorical meaning, it is an inexplicit meaning which the hearer has to recover by way of cultivating the perspective offered in the metaphor.",Degree: PhD,PDF file (641k),ETD,,Language and languages -- Philosophy,,PhD,2,somodi_gergo.pdf 
Sociology,PhD,http://tinyurl.com/kqqlj35,PhD (all years),36,https://sierra.ceu.edu/record=b1158251,http://www.etd.ceu.edu/2011/sphkoc01.pdf ,"Kocze, Angela","Gender, ethnicity and class : Romani women's political activism and social struggles / Angela Kocze","Budapest : Central European University, 2011",210 p. ; 30 cm.,CEU Sociology Department PhD theses ; 2011/2,Women political activists,English,"In the academic literature on Roma/Gypsies there is only a limited attention on Romani women political activism and social struggle. The concept of gender rather treated as an isolated category than as a social factor which intersects with other categories of identity for purposes of understanding and combating inequality. The aim of this dissertation has been to explain and analyze through empirical material the manifestations of gender, ethnicity and class in contemporary Romani women’s life. To narrow my study, I have focused on transnational and local (particularly Hungarian) Romani women’s political activism and social status, from the structural through the discursive and biographical level. I aimed to go beyond the superficial representation of women’s activism, by describing the complicated relationship and intercations among donors, NGOs, other Roma and non-Roma activists, and also within their groups. With the above outlined concerns in my mind, I undertook an empirical research project at the transnational level (mapping the various Roma networks and international resource centers) and at the local level (Szikszó, Hungary). As part of my research, I closely observed “women’s issues” at the transnational and the local level, as well as discourses and activities through which they promote “Romani women’s rights” and “human rights and democracy” under the banners of “empowering Romani women”. This area is under-researched and lacks theoretical conceptualization. The approach I have opted to take bridges empirical and theoretical gaps in the study of sociology and anthropology, particularly in respect of the representation of Roma in the academic text as well as to raise the profile of the research field by diminishing the marginalized position of them within the social sciences as a whole.",Degree: PhD,PDF file (2324k),ETD,Unrestricted,"Women, Romani -- Hungary",,PhD,2,sphkoc01.pdf 
Political science,MA,https://tinyurl.com/polma2019,2019,46,https://sierra.ceu.edu/record=b1421019,http://www.etd.ceu.edu/2019/stefani_benedict.pdf ,"Stefani, Benedict Paul Michael",Can impartiality be enforced when corruption is systemic? : the impact of the National Anticorruption Directorate on favouritism in local public procurement / Benedict Paul Michael Stefani,"Budapest : Central European University, 2019",95 p. ; 30 cm.,CEU Political Science Department master theses ; 2019/29,English,"Can increased judicial and electoral accountability in the form of strong anti-corruption agencies (ACAs) have a profound effect on corruption when it is systemic? Empirical evidence is mixed. Where success is absent, it remains unclear whether this is due to an insufficient implementation of ACAs and the legal framework they operate in or, as other scholars suggest, a misconceptualisation of systemic corruption. The present work addresses this controversy by bringing the deterrence effect and the political selection effect that the predominant principalagent- theory based literature suggests to an empirical test in the critical case of Romania. This is done by assessing the impact of National Anticorruption Directorate (DNA) prosecution in two forms – the announcement of investigations and the announcement of the final sentence – on favouritism in local public procurement. Based on 1.4 million public procurement contracts, Propensity Score Matching is employed to estimate the Average Treatment Effects on the Treated (ATTs) and the Conditional Average Treatment Effects on the Treated (CATTs) for Romanian localities affected by DNA prosecution concerning a composite risk score based on three red flags in the tendering process and a market domination indicator. The data reveals that the theoretical predictions cannot be confirmed. These findings may suggest that systemic corruption requires a more comprehensive approach which goes beyond currently predominant policies.",,PDF file (1209k),ETD,Unrestricted,System requirements: Adobe Acrobat Reader; PostScript compatible printer,,,MA,2,stefani_benedict.pdf 
Nationalism,MA,https://tinyurl.com/natma2019,2019,18,https://sierra.ceu.edu/record=b1421300,http://www.etd.ceu.edu/2019/szegofi_akos.pdf ,"Szegőfi, Ákos","From Jack the Ripper to Jamal the Rapist : disinformation, blood libel and the imagery of the immigrant criminal / Ákos Szegőfi","Budapest : Central European University, 2019",86 p. ; 30 cm.,CEU Nationalism Studies master theses ; 2019/16,English,"This thesis sets out to conceptualize the current moment of disinformation (called post-truth era by some researchers) arguing that there were several similar moments in Western history. The specific moment the thesis choose for comparison was the late 19th century, when – according to the assumptions of the thesis – the emerging mass media might have posed a similar challenge to human cognition as the emergence of social media does in contemporary times. The thesis works with Cultural Attraction Theory as its main framework and utilizes a case study methodology with discourse analysis. The particular disinformation that it focused on was a 19th century “blood libel”-case concerning immigrant populations and compared it to post-2015 disinforming narratives about refugee-seekers. The major findings consist of showing how similar ecological settings constitute to similar narratives due to the specificities of human cognition, while introduced Cultural Attraction Theory to the study of blood libels and disinformation in general.",Degree: MA,PDF file (2316k),ETD,Unrestricted,System requirements: Adobe Acrobat Reader; PostScript compatible printer,,,MA,2,szegofi_akos.pdf 
Economics,Business,https://tinyurl.com/ecobus2019,2019,14,https://sierra.ceu.edu/record=b1423211,http://www.etd.ceu.edu/2019/szilagyi_laszlo.pdf ,"Szilagyi, Laszlo Janos",Data analysis and model building support for the development of a future mHealth solution for musculoskeletal diagnosis / Laszlo Janos Szilagyi,"Budapest : Central European University, 2019",11 p. ; 30 cm,CEU Economics and Business Department master theses ; 2019/11,English,"This capstone project for the CEU Msc in Business Analytics program aims to provide data analysis and model building support for the development of Sportklinikaâ€™s Mobile Motion Lab, the basis of a future mHealth solution for musculoskeletal diagnosis.",Degree: MSc,PDF file (63k),ETD,Capstone  project,Unrestricted,.,,Business,2,szilagyi_laszlo.pdf 
Legal studies,MA,https://tinyurl.com/legalma2020,2020,78,https://sierra.ceu.edu/record=b1429077,http://www.etd.ceu.edu/2020/tarkhnishvili_keteva.pdf ,"Tarkhnishvili, Ketevan",Enforcement of international mediated settlement agreements under Singapore Convention in comparison to enforcement of international arbitration awards under New York Convention / Ketevan Tarkhnishvili,"Budapest : Central European University, 2020",37 p. ; 30 cm.,CEU Legal Studies Department master theses ; 2020/72,English,"The most essential motivation for adoption of Singapore Convention was to establish something similar for mediation as New York Convention is for arbitration. The most important achievement of international arbitration compare to international mediation has always been considered its predictability and the guarantees of enforcement. However, after appearance of Singapore Convention, the international mediation has the perspective to reach the same heights as international arbitration does. Accordingly, the intend of the research is to find out, whether the application of Singapore Convention can potentially become as widely used and as successful as it is in case of New York Convention. For the mentioned purpose the paper provides the comparative analyzes of core provisions such as scope for application, general principles and reservations of Singapore Convention in compare to the similar Articles under New York Convention. The paper also compares the main terminological differences and its backgrounds in those two Conventions.",Degree: MA,PDF file (722k),ETD,Unrestricted,System requirements: Adobe Acrobat Reader; PostScript compatible printer,,,MA,2,tarkhnishvili_keteva.pdf 
Environmental sciences,MSc,https://tinyurl.com/envma2018,2018,22,https://sierra.ceu.edu/record=b1401947,http://www.etd.ceu.edu/2018/tofiloski_slobodan.pdf ,"Tofiloski, Slobodan",Geospatial analysis of water-associated infectious diseases : case of Myanmar / Slobodan Tofiloski,"Budapest : Central European University, 2018",107 p. ; 30 cm.,CEU Department of Environmental Sciences & Policy master theses ; 2018/20,English,"Water can serve as a medium for pathogenic organisms, posing substantial health treats to humans through the variety of pathways. Water-associated infectious diseases are a major cause of morbidity and mortality in Myanmar. The recent environmental and social changes in Myanmar have significant influence over water-associated infectious diseases and it is expected for that trend to continue in future. Alterations in climate factors, human migration caused by several ongoing armed conflicts, low levels of sanitation, difficult access to clean drinking water, increased agricultural practices and industrialization; all of them can change the patterns of distribution, emergence, and re-emergence of the water-associated infectious diseases in Myanmar. This research utilizes the social and environmental determinants mentioned above and water-associated prevalence data in conjunction with a GIS analysis method, to present the distribution and risk of the water-associated diseases in Myanmar and their relation with diverse factors. The results show that Yangon has the highest number of waterborne diseases outbreaks and second highest number of water-related diseases outbreaks. Results also show that there is specific interconnected influence of different factors, with some of them dominating in certain states or regions.",Degree: MSc,PDF file (2730k),ETD,Unrestricted,System requirements: Adobe Acrobat Reader; PostScript compatible printer,,,MA,2,tofiloski_slobodan.pdf 
School of public policy,PhD,http://tinyurl.com/gl5s68p, PhD (all years),20,https://sierra.ceu.edu/record=b1428103,http://www.etd.ceu.edu/2020/torotcoi_simona.pdf ,"Torotcoi, Simona",From international commitments to institutional reality : the case of higher education policy in Europe / Simona Torotcoi,"Budapest : Central European University, 2020",245 p. ; 30 cm.,CEU School of Public Policy PhD theses ; 2020/3,"Education, Higher -- Europe",Degree: PHD,Education and state -- Europe,English,PDF file (11748k),"This dissertation aimed to address the implementation gap of the Bologna Process (BP) as a transnational, voluntary higher education policy framework. Established 20 years ago as a voluntary cooperation initiative on higher education cooperation in Europe, the BP has set important policy objectives for national higher education systems and Europe at large. While government representatives, through the ministerial meetings constantly agree on what they should implement in their national higher education systems, implementation reports show considerable differences between countries and higher education institutions (HEIs) with regard to implementation. Starting with the early stages of the BP scholarly work has demonstrated that there is an increasing interest in studying the different dimensions of BP implementation. A considerable amount of these studies has focused on assessing and explaining the different levels of BP implementation yet there is a gap in addressing the implementation of the BP from an integrated perspective. This dissertation aimed to fill this gap and asked What are the factors explaining the different levels of implementation of higher education policies within the Bologna Process? First of all, this dissertation seeks address the research gap by focusing on specific policy areas within the BP (quality assurance and the social dimension), diverse county contexts and higher education institutions within such contexts (Moldova, Portugal, and Romania). Secondly, it aims to contribute to the broader policy implementation literature by providing a conceptual understanding of policy implementation, by breaking it into adoption, transposition and practical implementation, and by putting forward an integrated set of factors for each of the three implementation stages, and empirically test them through semi-structured interviews. The dissertation hypothesizes three causal mechanisms for each of the implementation levels. Firstly, is hypothesized that adoption is the result of policy fit between commonly agreed policies at the BP level and national preferences and interests, as resulted through national representatives’ participation in BP. The causal model predicts that if BP policies have the support of top domestic actors and structures, this may push the national policies closer to the ones promoted by the BP. As a result, BP structures prefer to collaborate with those domestic actors who are in favor of its policies. Secondly, specific to the transposition stage it can be hypothesized that mutual learning and other socialization processes equip governmental agencies and bodies, societal actors, and the academic community with information about the main developments at the EHEA level and contribute to national level policy-making by feeding back national policy makers, affecting the choice for specific policy instruments and implementation mechanisms. Last but not least, at the HEIs level rectors and top-managers, academic and administrative staff, and students develop institutional plans and policies in line with the national level policies or the BP depending on their participation as stakeholders in the policy-making processes, autonomy and the added value of the policies in question. First of all, this dissertation highlighted the complex relationship between the BP, national, and institutional policy-making and the importance of national and institutional (interest) structures, actors (coalitions) and processes in connecting these levels. While it is assumed that that there is a “filter” when it comes to the implementation the BP commitments, with each level and layer of policy-making preconditioning the following (adopting the necessary legislation, transposition and institutional practices) this dissertation has shown that this is very much dependent on the policy in question. Quality assurance (QA) is a rather structural and technical area, with clear conceptualizations and operationalizations, with structures and bodies at the European, national and institutional level, whereas the social dimension (SD) is underdeveloped in this respect. HEIs implement QA policies because of the competitive environment they have to operate in but also because of the existent monitoring mechanisms (at the institutional, national and BP level). The SD is a rather sensitive area, with most of the universities putting forward their preferred approaches on how to deal with such issues. If in the case of QA in most of the country cases there is a national level agency which pushes for implementation at the HEIs level, in the case of SD the situation is loose.",ETD,"CEU Doctoral School of Political Science, Public Policy and International Relations",,PhD,2,torotcoi_simona.pdf 
Mathematics,PhD,http://tinyurl.com/cysrae, PhD (all years),63,https://sierra.ceu.edu/record=b1131751,http://www.etd.ceu.edu/2008/tphpac01.pdf ,"Palmer, Cory Thomas",Edge-weightings and the chromatic number / Cory Thomas Palmer,"Budapest : Central European University, 2008",85 p. ; 30 cm.,CEU Department of Mathematics PhD theses ; 2008/4,English,"Motivated by the difficulty of determining bounds on the chromatic number of a graph, we examine several new graph parameters  that are related to the standard chromatic number. These parameters are based on edge-weightings and are interesting in their own right but they also have potential  consequences for the chromatic number.  The core of the thesis will be dedicated to the particular problem to determine the minimum number of weights needed to assign to the edges of a graph $G$ with no component $K_2$ so that any two adjacent vertices have distinct sets of weights on their incident edges.  The main result is that this minimum is at most $\lceil \log_2 \chi(G) \rceil+1$. This upper-bound is best possible for $\chi(G) \geq 3$. We also characterize the case when $\chi(G) = 2$.",Degree: PhD,PDF file (383k),ETD,Unrestricted,System requirements: Adobe Acrobat Reader; PostScript compatible printer,Graph theory,,PhD,2,tphpac01.pdf 
Philosophy,PhD,http://tinyurl.com/yhque8b, PhD (all years),45,https://sierra.ceu.edu/record=b1168527,http://www.etd.ceu.edu/2013/varga_alexandra-lucia.pdf ,"Varga, Alexandra Lucia",A formal model of infants' acquisition of practical knowledge from observation / Alexandra Lucia Varga,"Budapest : Central European University, 2013",221 p. ; 30 cm.,CEU Philosophy Department PhD theses ; 2013/5,Philosophy of mind,English,"The thesis is concerned with modelling observational learning as exhibited by infants in the above mentioned studies. The primary aim is to construct a process model that accounts for the empirical results from within the rationalist explanatory framework. I assume that young agents’ instrumental behavior is supported by practical reasoning processes; I justify this assumption by a review of empirical data from developmental psychology. The full-fledged model corroborates the developmentalists’ claim regarding the inferential support for imitative learning. It strengthens the argument that infants’ learning of practical skills and artifact functions from observation of adult human agents is an instance of teleological instrumental rationality. However the roles of perceptual, motor, or memory capacities of the human mind are also considered. The model is built in the thesis in two steps: first I spell out the proposed conceptualization of the processes that support infants’ performance in the head-touch task, and then I provide a technical depiction of those processes in the logic of choice.",Degree: PhD,PDF file (1751k),ETD,,Agent (Philosophy),,PhD,2,varga_alexandra-lucia.pdf 
Environmental sciences,MSc,https://tinyurl.com/envma2019,2019,16,https://sierra.ceu.edu/record=b1422715,http://www.etd.ceu.edu/2019/voski_anais.pdf ,"Voski, Anaïs",The ecological significance of the overview effect : environmental attitudes and behaviours in astronauts / Anais Lynn Voski,"Budapest : Central European University, 2019",112 p. ; 30 cm.,CEU Department of Environmental Sciences & Policy master theses ; 2019/15,English,"In the context of the 21st century’s intensifying ecological crisis and the New Space Age, this year’s 50th anniversary of the Apollo 11 Moon landing provides a functional framework for investigating potentially unknown connections between environmentalism and human space exploration. Limited evidence in the existing literature suggests that the Overview Effect – the cognitive shift in awareness experienced by astronauts as a result of seeing Earth from outer space – may contain much greater ecological dimensions than has been previously implied. Based on 14 first-hand interviews with astronauts, this study utilizes interpretive phenomenological analysis to qualitatively demonstrate that the Overview Effect has a distinct ecological significance that results in positive changes to astronauts’ environmental attitudes and behaviours. Besides this change, the results qualitatively map the breadth and depth of astronauts’ present environmental attitudes and behaviours, which has also not been done prior to this study. The outer space perspective of Earth, which includes negative perceptual views of anthropogenic ecological destruction on the surface of the planet, is shown to add a new and additional element to environmentalism, and as such discourse analysis is used to demonstrate how the ecological impulse concept is useful for advancing theoretical formulations of how spaceflight affects environmental attitudes. Furthermore, an expanded definition of the astroenvironmentalism concept is proposed to encapsulate this distinct form of environmentalism, to facilitate more straightforward discussions on the topic, and to make this phenomenon and form of environmentalism more relevant and accessible to a wider audience.",Degree: MSc,PDF file (1581k),ETD,Unrestricted,System requirements: Adobe Acrobat Reader; PostScript compatible printer,,,MA,2,voski_anais.pdf 
