department,program,lib_link,year,thesis_in_that_year,thesis_link,pdf_link,author,title,published,description,series,language,summary,note,filetype,localnote,access,systemdet,subject,alttitle,program_sampling,flag,coder
Economics,MA,https://tinyurl.com/ecoma2020,2020,4,https://sierra.ceu.edu/record=b1427841,http://www.etd.ceu.edu/2020/bittencourt_glauco.pdf ,"Bittencourt, Glauco Ferreira",The Brazilian labor reforms of 2017 : how does the flexibilization of employment protection legislation affect wages? / Glauco Ferreira Bittencourt,"Budapest : Central European University, 2020",62 p. ; 30 cm,CEU Economics Department master theses ; 2020/2,English,"The purpose of this thesis is to estimate the effects of the Brazilian labor reforms on the average wage of workers. In November 2017, the biggest legislative package of amendments of employment protection legislation (EPL) was enacted in Brazil. Among many revisions, important legislative changes were implemented, such as the abolition of compulsory union contribution; introduction of intermittent contracts; prevail of individual and collective agreements over state legislation; and introduction of a mutual contract termination agreement with a lower severance payment. These legislative changes are assessed to estimate their effects on average wages of workers by using repeated cross-section data and a difference-in-differences methodology with fixed-effects. The identified control group is composed of civil servants and the treatment group is formed of workers in the private sector. The results suggest that loosening employment protection legislation - at least in the Brazilian context - leads to a decrease of average wages in the labor market.",Degree: MA,PDF file (966k),ETD,Unrestricted,System requirements: Adobe Acrobat Reader; PostScript compatible printer,,,MA,0,1
History,PhD,http://tinyurl.com/ycayjpm, PhD (all years),60,https://sierra.ceu.edu/record=b1427988,http://www.etd.ceu.edu/2020/medzibrodszky_alexandra.pdf ,"Medzibrodszky, Alexandra","Orthodox political theologies : clergy, intelligentsia and social Christianity in revolutionary Russia / Alexandra Medzibrodszky","Budapest : Central European University, 2020",281 p. ; 30 cm.,CEU History Department PhD theses ; 2020/1,Religion and state,Orthodox Eastern Church -- Russia,Orthodox Estern Church and culture,Christian sociology,English,DOI: 10.14754/CEU.2020.08,"The dissertation is the intellectual history of the Orthodox left during the revolutionary years of 1905-8 in Imperial Russia. The research reconstructs debates and dialogues between progressive clergy and radical religious intelligentsia following the massacre of Bloody Sunday on 9 January 1905. The dissertation interprets the visions that emerged in the network of the Orthodox left in the framework of ‘political theologies’. It focuses on three programs and their theo-political language: the Brotherhood of Zealots for Church Renovation; the Christian Brotherhood of Struggle; and the Union of Christian Politics. Members argued that the mutually dependent relationship between the tsar and the people, which served as a political bedrock for the Empire for centuries, was now beyond repair. The bloodshed was perceived as a fundamental break in Russian Orthodox political theory, and the horrible events inspired religious intelligentsia and progressive clergy to theorise about politics and social justice as Orthodox believers. The dissertation identifies the concept of Christian obshchestvennost’ (sociality) as the focal point of all programs that emerged among advocates of the Orthodox left in the period. The concept had palingenetic power, it was meant to reinvigorate the Church and to re-Christianise the whole of fin de siècle Russian society. My research argues that the theo-political imagination and language of the Orthodox left was inspired both by Russian Orthodox tradition, in particular by Modern Russian Theology; and by non-Orthodox traditions of social Christianity, but it developed in opposition to the Marxist left. The analysed projects were short-lived due to internal conflicts and repressions by Church and state, but they represent a vibrant chapter in the history of Russian Orthodox social and political thought, reflecting on theo-political concepts that remain central to the Russian Orthodox world up until today.",CEU Doctoral School of History,,PhD,0,1
Environmental sciences,MESPOM,https://tinyurl.com/envmespom2020,2020,12,https://sierra.ceu.edu/record=b1428076,http://www.etd.ceu.edu/2020/black_benjamin.pdf ,"Black, Benjamin Samuel",Assessing the ecological effectiveness of protected areas in Cambodia : a quasi-experimental counterfactual estimation of avoided deforestation / Benjamin Black,"Budapest : Central European University, 2020",209 p. ; 30 cm.,CEU Department of ES MESPOM Programme master theses ; 2020/2,English,"In the face of global environmental change, protected areas (PAs) have become an increasingly important tool in modern conservation, and as such there is a clear imperative to maximise the benefits they provide. In this regard a growing field of interest is the quantification of PA ecological effectiveness, often expressed in terms of avoided deforestation achieved relative to unprotected areas. However, such assessments are confounded by biases in both the non-random siting of PAs within landscapes as well as differential pressure upon their resources. These biases can be overcome by the use of quasi-experimental counterfactual study designs, that evaluate the impact of PAs against control areas of ‘similar’ biophysical and socio-economic characteristics. To contribute towards this knowledge domain this study presents an assessment of PA effectiveness for the Southeast Asian nation Cambodia, which, in light of its history of natural resource management, represents a pertinent case study. PA effectiveness was analysed using propensity score matching for three different outcome periods between 2010-2018 with the results finding significant positive treatment effects in each, with forested land in PAs being as much as 8% less likely to be deforested than similar unprotected forest. In addition to this a significant positive spillover effect of PAs was observed in 5km buffers zones adjacent to their boundaries, resulting in a maximum of 4% reduction in probability of deforestation. Furthermore, the effectiveness of PAs in Cambodia was found to vary under differential deforestation pressure as well as with regards to the duration of time since PA establishment.",Degree: MSc,PDF file (6599k),ETD,Unrestricted,System requirements: Adobe Acrobat Reader; PostScript compatible printer,,,MA,0,1
School of public policy,MA,https://tinyurl.com/sppma2020,2020,24,https://sierra.ceu.edu/record=b1428443,http://www.etd.ceu.edu/2020/medenica_mirko.pdf ,"Medenica, Mirko",Open border policy and Western Balkans : policy option for regions economic and reform fatigue? / Mirko Medenica,"Budapest : Central European University, 2020",47 p. ; 30 cm.,CEU School of Public Policy master theses ; 2020/15,English,"The Western Balkans region is currently in a political and social vacuum. For two decades, the process of joining the European Union has been a driving force in institutional, political and economic reforms. European enlargement fatigue has led to both economic and reform fatigue in the countries of the region. As a consequence of slowdown of reforms and weak economy, a large number of citizens is emigrating in developed countries. Labor shortages and brain drain are becoming an obstacle to economic development and the region is failing to reach growth rates that would bring it closer to European Union countries. In order to get out of this stalemate, a radical turn is needed, both in terms of initiative for change and in terms of solutions. With the lack of interest of European Union for the region, it is up to countries of the region to take the initiative. The idea of open borders in the region is a possible solution that would alleviate directly the economic and demographic problems and indirectly political problems faced by the countries of the region.",Degree: MA,PDF file (665k),ETD,Unrestricted,System requirements: Adobe Acrobat Reader; PostScript compatible printer,,,MA,0,1
Gender studies,MA,https://tinyurl.com/genderma2020,2020,26,https://sierra.ceu.edu/record=b1428477,http://www.etd.ceu.edu/2020/gogberashvili_ani.pdf ,"Gogberashvili, Ani","Gendered experience of time in Georgia : motherhood, care work and the life beyond / Ani Gogberashvili","Budapest : Central European University, 2020",54 p. ; 30 cm.,CEU Gender Studies Department master theses ; 2020/12,English,"First, associated with the cycles of nature, later with the emergence of capitalism, the perception of time became associated with the linearity of the production process and became commodified. Time as a resource, reflecting the power relations, is distributed unequally within the groups of people, with some spending most of the time working to ensure survival, while others are enjoying vast amounts of discretionary time. In contemporary society, the lack of time is especially acute in the lives of working mothers. The persistent essentialist understanding of motherhood still requires women to devote most of their time beyond paid employment to caregiving, and the standard working hours not taking the time needed for care responsibilities into account. This thesis explores the time poverty experienced by working mothers in Georgia who, due to unregulated working hours and the demands of motherhood, enjoy little to no temporal autonomy. The aim of the research is to analyze the perceptions of time for them and study the ways in which they distribute their time between paid labor, unpaid labor, and leisure and the reasoning behind this arrangement. I argue that the perception of time for working mothers in Georgia, shaped by the essentialist understanding of motherhood, is malleable and adaptable to immediate circumstances, different from the rigidity of capitalist temporality. The data collected through in-depth semi-structured interviews suggest that women perceive time poverty as their individual problem instead of questioning structural inequality leading to this condition; respondents assume that they have more control over their time than they actually do. Over the years, they have adopted different time management and time-saving strategies in order to utilize their time beyond paid employment and meet the contradictory standards of a good employee and a good mother. For this, they often have to juggle several tasks at a time, seek paid or unpaid help from other females, sacrifice their professional growth and leisure time, and put extensive effort into scheduling every minute of their days.",Degree: MA,PDF,ETD,Unrestricted,System requirements: Adobe Acrobat Reader; PostScript compatible printer,,,MA,0,1
Legal studies,MA,https://tinyurl.com/legalma2020,2020,78,https://sierra.ceu.edu/record=b1428993,http://www.etd.ceu.edu/2020/borodenchyk_tereza.pdf ,"Borodenchyk, Tereza",Violent attacks against Roma by right-wing radical groups in Hungary and Ukraine / Tereza Borodenchyk,"Budapest : Central European University, 2020",39 p. ; 30 cm.,CEU Legal Studies Department master theses ; 2020/13,English,"Right-wing ideology is a movement based on the belief in the superiority of some individuals and groups as well as the inferiority of others. This ideology caused a number of violent attacks against Roma in Hungary in 2008-2009 and in Ukraine in 2018. Members of right-wing movements attacked Roma settlements, destroying houses, injuring and killing people. The two main focuses of the paper are: to discuss the social and political pre-conditions and the general societal environments in which the attacks were committed, and to outline the main human rights violations committed by the states while responding (or not responding) to the attacks.",Degree: MA,PDF file (490k),ETD,Unrestricted,System requirements: Adobe Acrobat Reader; PostScript compatible printer,,,MA,0,1
Legal studies,MA,https://tinyurl.com/legalma2020,2020,78,https://sierra.ceu.edu/record=b1429005,http://www.etd.ceu.edu/2020/fatima_hanan.pdf ,"Fatima, Hanan",Searching for best interests of unaccompanied children : a comparative study: United Kingdom and France / Hanan Fatima,"Budapest : Central European University, 2020",44 p. ; 30 cm.,CEU Legal Studies Department master theses ; 2020/22,English,"Since the refugee crisis in 2015, thousands of children have come to the Europe alone and in need of asylum. It is an enormous task to project an accurate figure for the number of unaccompanied children seeking asylum as the numbers are not quite consistent. There is no real data despite the existence of several monitoring systems that are presently in place. Many unaccompanied children have disappeared whilst navigating their way across various geographic terrains as they flee persecution in their country of origin, predominantly as a result of conflict. Resultantly, some cross borders in search of their parents, while others become victims of child trafficking. This study centres on a comparative analysis of the rights of UMs in the United Kingdom(UK) and France and is done via the vantage point of migration and asylum processes. The study contributes to the discussion regarding the compliance of states on the primary consideration for the best interests of the child, presenting a prescriptive view in reviewing the application of the CRC and the EU acquis. This is carefully done taking into account the asylum laws and procedures of the State and the EU into account. This study, while analysing the implementation of the best interests of the child, tries to understand in whose best interests are policies and laws are created - the state or the child. The thesis concludes with the summation of reasons of noncompliance with the CRC recommendations, and the infringement of the principle rights of the child during age assessment procedures. It also acknowledges increasing disobedience by the UK in comparison to France due to the current and changing political situation, specifically Brexit and the impact it has had on the policies regarding unaccompanied children in the UK.",Degree: MA,PDF file (435k),ETD,Unrestricted,System requirements: Adobe Acrobat Reader; PostScript compatible printer,,,MA,0,1
Legal studies,MA,https://tinyurl.com/legalma2020,2020,78,https://sierra.ceu.edu/record=b1429016,http://www.etd.ceu.edu/2020/hamda_robera-haile.pdf ,"Hamda, Robera Haile",The protection of franchisees in Ethiopia : de lege lata and de lege ferenda / Robera Haile Hamda,"Budapest : Central European University, 2020",43 p. ; 30 cm.,CEU Legal Studies Department master theses ; 2020/32,English,"Business format franchise, which emerged in the United States, has become a common way of doing business and subject to regulation in many parts of the world including more recently Ethiopia. Despite the recent legislative developments, the regulation of franchise in Ethiopia is far from being adequate, in particular, it fails to provide a clear regulatory framework and is unable to respond to the existing franchise abuses in Ethiopia. These defects result in lots of uncertainties that will inevitably negatively affect entrepreneurship and the emergence of a viable strong local franchise industry as well as be an obstacle in attracting foreign franchisors which could contribute to the country’s economy. The aim of this thesis is to critically assess the protection of franchisees in Ethiopia as one of the cornerstones of modern business format franchise by analyzing the recent Ethiopian legislative developments aimed at promoting the business model in light of global and local trends as well as the experiences of selected jurisdictions. The comparison will extend to three countries’ laws and experiences. The United States is chosen because of its rich experience in franchise regulation as it is the origin of the business model itself. Hungary was chosen because it represents the other spectrum of the regulation with more historical similarity with Ethiopia and economic proximity in comparison with other European countries and additionally because of similarity in the regulation and protection of franchisees. South Africa has been selected to see the regulation and protection of franchisees because it represents a unique approach to franchise regulation and to see the regulation of franchise from an African perspective.",Degree: MA,PDF file (471k),ETD,Unrestricted,System requirements: Adobe Acrobat Reader; PostScript compatible printer,,,MA,0,1
Philosophy,MA,https://tinyurl.com/philma2020,2020,15,https://sierra.ceu.edu/record=b1429127,http://www.etd.ceu.edu/2020/kovacevic_duje.pdf ,"Kovacevic, Duje","Assisted dying, depression and autonomy : a case against self-determination / Duje Kovacevic","Budapest : Central European University, 2020",66 p. ; 30 cm.,CEU Philosophy Department master theses ; 2020/9,English,"Severely depressed people are allowed to die with assistance in only four countries in the whole world. Those who advocate for it claim that any seriously ill adult should have the opportunity to die with assistance through their right to self-determination – the right to determine what is in their best interest. Those who oppose it claim that depression makes patients non-autonomous and incompetent of making end-of-life decisions. In this thesis I argue that assisted dying should be available to severely depressed people. However, I disagree with both of the camps. I argue that the self-determination model is not adequate because it is either practically unlimited or it fails to achieve its function. Alternatively, I propose the consent model of autonomy on which patients merely authorize the doctors to assist them in dying, while the patient’s best interest is determined objectively by the doctors.",Degree: MA,PDF file (469k),ETD,Unrestricted,System requirements: Adobe Acrobat Reader; PostScript compatible printer,,,MA,0,1
Sociology,MSc,https://tinyurl.com/socma2020,2020,27,https://sierra.ceu.edu/record=b1429143,http://www.etd.ceu.edu/2020/golusin_slobodan.pdf ,"Golusin, Slobodan",Formation of informal and decentralized value chains through platform outsourcing : exploring the network of Serbian UpWork freelancers / Slobodan Golusin,"Budapest : Central European University, 2020",62 p. ; 30 cm.,CEU Sociology Department master theses ; 2020/8,English,"This thesis explored the case of the formation of value chains through the outsourcing of work via digital labour markets. It illuminates on how these value chains span beyond digital labour market UpWork and are built on the local relations within Serbian freelance network. The main question of the thesis is how the organization of production specific to UpWork, as well as locally conditioned market positions and structural differences of freelancers, shape the relations within this network. Firstly, I analyse how the value chains span into the network through re-outsourcing of work between freelancers and enable value capture for individual freelancers. Those who outsource act as suppliers in the value chains and depend on trust relations with their subcontractors, while those subcontractors who are in weak structural positions both on the platform and domestic labour market depend on them for access to jobs and platform reputation. Secondly, I show how the network is utilized for learning, as well as social and emotional support. As freelancers act as fragmented suppliers of which majority is in extremely precarious positions and acts mostly as a labour reserve army, these processes are needed for their further engagement in the market. Furthermore, due to structural constraints, this network lacks capacities for political organization and it serves primarily individuals to compete within these value chains. Thus, the processes of value creation and capture, learning and cooperation, as well as relational work, which are regularly integrated into firm value chains, are in the case of platform outsourcing dispersed and decentralized throughout the freelance networks constructed from the bottom-up.",Degree: MA,PDF file (1015k),ETD,Unrestricted,System requirements: Adobe Acrobat Reader; PostScript compatible printer,,,MA,0,1
IR,MA,https://tinyurl.com/iresma2020,2020,39,https://sierra.ceu.edu/record=b1429232,http://www.etd.ceu.edu/2020/arevalo_kelly.pdf ,"Arévalo, Kelly Johana",The Indian way : a polyvalent rising power / Kelly Arevalo,"Budapest : Central European University, 2020",46 p. ; 30 cm.,CEU International Relations Department master theses ; 2020/5,English,"This dissertation focuses on India’s behavior as a rising power, drawing attention to its relative peaceful rise, to explain why has India charted an emerging course very different from its Eurasian counterparts, Russia and China? India has adopted a foreign policy that differs from the general expectations of orthodox International Relations (IR) theories- those focusing on power transitions and international institutions- that assume India eventually would pursue the modification of the current global order- a revisionist behavior- or perhaps would slightly adjust the institutional order, maintaining the status quo. The three-level analysis of India’s foreign policy from 2001 to 2018, shows that India is taking different pathways depending on the level and realm of geopolitical scope. I argue that India is a polyvalent rising power, demonstrating that India pursued a reactive behavior at the local (South Asia) level, at the regional (Indian Ocean Region) level it was characterized by its engagement, while at the global level its role was active. This dissertation aims to contribute to the understanding of India’s rise and its foreign policy, as well as to offer a different perspective to IR studies on rising powers by showing India’s relevance for the construction of a broader literature.",Degree: MA,PDF file (725k),ETD,Unrestricted,System requirements: Adobe Acrobat Reader; PostScript compatible printer,,,MA,0,1
IR,MA,https://tinyurl.com/iresma2020,2020,39,https://sierra.ceu.edu/record=b1429245,http://www.etd.ceu.edu/2020/bihan-poudec_emma.pdf ,"Bihan-Poudec, Emma Isma","An analysis of the demobilisation, disarmament and reintegration process of former FARC fighters in Colombia / Emma Isma Bihan-Poudec","Budapest : Central European University, 2020",57 p. ; 30 cm.,CEU International Relations Department master theses ; 2020/11,English,"The implementation of Disarmament, Demobilisation and Reintegration (DDR) processes represent an important part of post-conflict transition. By enforcing the stateâ€™s monopoly on armed forces and integrating political opponents, these mechanisms hold a promising potential towards the reconstruct war-torn nations. In 2016, the government of Colombia reached an historic peace deal with the FARC (Fuerzas Armadas Revolucionarias de Colombia) guerrilla, thus ending the longest lasting civil war in the Americas. After more than 50 years of civil war, in which hundreds of thousands were killed and millions displaced, the implementation of DDR started. Now in its third year, the implementation is slow, uneven and is encountering several difficulties. In August 2019, some ex-FARC leaders called for the return of an armed insurgency, citing the failures of the Colombian government in implementing the Peace Agreement. As mitigated results of the DDR in Colombia emerge, an overall assessment is valuable. This paper aims to provide insights in the implementation of the DDR process of former FARC fighters in Colombia. The research is based on process-tracing and semi-structured interviews conducted with organisations which designed, implemented and monitored of the peace process. By combining these insights and methods, this research permits to highlights the successes and challenges of this DDR process. This research identifies key obstacles and opportunities for DDR in Colombia, highlighting the programmatic successes for the demobilisation and disarmament phases and identifying institutional weakness, programmatic flaws and the role of spoilers as key explanatory factors for the shortcomings of the reintegration in Colombia.",Degree: MA,PDF file (454k),ETD,Unrestricted,System requirements: Adobe Acrobat Reader; PostScript compatible printer,,,MA,0,1
